animeid,title,genres
3342,Mnemosyne: Mnemosyne no Musume-tachi,"Action, Sci-Fi, Horror, Supernatural, Shoujo Ai"
3345,Mikan Enikki,"Slice of Life, Comedy, Romance, Shoujo"
3349,Kiddy GiRL-AND,"Action, Comedy, Sci-Fi, Super Power"
3352,Tengen Toppa Gurren Lagann: Mitee Mono wa Miteen da!!,"Action, Adventure, Comedy, Mecha, Sci-Fi"
3354,Zombie-Loan Specials,"Action, Horror, Supernatural, Shounen"
3355,Fortune Dogs,Adventure
3356,Mahoutsukai Sally,"Magic, Fantasy, School, Shoujo"
3358,Kure-nai,"Comedy, Drama, Martial Arts"
3359,Amatsuki,"Action, Historical, Demons, Supernatural, Fantasy, Josei"
3361,UFO Senshi Dai Apolon,"Action, Sci-Fi, Mecha"
3362,Oshare Majo Love and Berry: Shiawase no Mahou,Magic
3363,RD Sennou Chousashitsu,"Action, Sci-Fi"
3366,Persona: Trinity Soul,"Action, Sci-Fi, Super Power"
3367,Furusato Japan,Historical
3369,Shoubushi Densetsu Tetsuya,"Game, Historical, Shounen"
3371,Ginga Eiyuu Densetsu Gaiden,"Action, Military, Sci-Fi, Space"
3372,RGB Adventure,Adventure
3381,Fushigi no Umi no Nadia Specials,"Adventure, Sci-Fi"
3388,Majokko Megu-chan,"Magic, Shoujo"
3389,Bus Gamer,Action
3390,Hoshi no Umi no Amuri,"Sci-Fi, Adventure, Fantasy"
3391,Maicching Machiko-sensei,"Comedy, Ecchi, School"
3392,Kiniro no Corda: Primo Passo - Hitonatsu no Encore,"Harem, Music, Romance, School, Shoujo"
3394,Kimagure Orange☆Road: Shounen Jump Special,"Romance, Drama, Shounen"
3398,Shin Hurricane Polymar,"Action, Martial Arts, Super Power, Sci-Fi"
3399,Rokushin Gattai GodMars,"Action, Mecha, Sci-Fi, Space"
3401,Aru Tabibito no Nikki Specials,"Adventure, Fantasy"
3406,iDOLM@STER Xenoglossia Specials,"Comedy, Mecha, Sci-Fi"
3407,Blassreiter,"Action, Sci-Fi"
3410,Sky Girls Specials,"Comedy, Mecha, Military, Sci-Fi"
3414,Hula Kappa,Comedy
3417,Yawaraka Sangokushi Tsukisase!! Ryofuko-chan,"Comedy, Ecchi, Magic"
3418,Jungle no Ouja Taa-chan,"Action, Comedy, Parody"
3419,Sumomomo Momomo: Chijou Saikyou no Yome Specials,"Comedy, Ecchi, Martial Arts, Romance"
3420,Shigofumi,"Psychological, Supernatural, Drama, Thriller, Fantasy"
3421,Kodomo no Omocha,"Comedy, Drama, School, Shoujo"
3424,Porphy no Nagai Tabi,"Drama, Historical, Kids, Slice of Life"
3425,Meiken Lassie,"Adventure, Slice of Life, Kids"
3429,Blame! Special,"Mecha, Sci-Fi"
3430,Blame! Prologue,"Action, Mecha, Sci-Fi"
3432,Chou Mashin Eiyuuden Wataru,"Action, Adventure, Comedy, Mecha"
3433,Go-Q-Choji Ikkiman,"Sci-Fi, Sports"
3434,Hey! Bumboo,"Adventure, Cars, Kids"
3435,Joou Heika no Petite Angie,"Historical, Mystery, Shoujo"
3436,Meme Iroiro Yume no Tabi,"Adventure, Kids, Sci-Fi"
3437,Mister Ajikko,"Comedy, Shounen"
3438,Moero! Top Striker,"Action, Shounen, Sports"
3444,The☆Ultraman,"Action, Sci-Fi, Space, Super Power"
3446,Biohazard: Degeneration,"Action, Horror, Sci-Fi"
3447,Ghost in the Shell: Stand Alone Complex - Solid State Society - Uchikoma no Hibi,"Comedy, Mecha, Sci-Fi"
3448,Mad★Bull 34,"Action, Police"
3449,Kamichu! Specials,"Slice of Life, Comedy, Supernatural, Drama"
3451,Space Oz no Bouken,"Adventure, Sci-Fi"
3455,To LOVE-Ru,"Sci-Fi, Harem, Comedy, Romance, Ecchi, School, Shounen"
3456,Candy☆Boy: Side Story For Archive,"Romance, School, Shoujo Ai"
3457,Vampire Knight,"Drama, Mystery, Romance, Shoujo, Supernatural, Vampire"
3458,Pi Po Pa Po Patrol-kun,"Comedy, Kids"
3460,Bosco Daibouken,"Kids, Adventure, Fantasy"
3461,Gensou Jotan Ellcia,"Adventure, Fantasy"
3462,Minky Momo in Yume ni Kakeru Hashi,"Drama, Shoujo, Slice of Life"
3463,A.LI.CE,Sci-Fi
3464,Kemeko Deluxe!,"Action, Comedy, Ecchi, Romance, School, Sci-Fi, Shounen"
3465,Nagasaki 1945: Angelus no Kane,"Drama, Historical, Military"
3466,Kino no Tabi: The Beautiful World - Tou no Kuni,"Adventure, Fantasy, Psychological"
3467,Nogizaka Haruka no Himitsu,"Comedy, Romance"
3468,Maria-sama ga Miteru Specials,"Drama, Romance, School, Shoujo, Shoujo Ai, Slice of Life"
3469,Maria-sama ga Miteru: Haru Specials,"Slice of Life, Romance, School, Drama, Shoujo, Shoujo Ai"
3470,Special A,"Comedy, Romance, School, Shoujo"
3472,Tenrankai no E,Comedy
3473,Souseiki,Parody
3474,Push,Parody
3475,Muramasa,"Historical, Horror, Martial Arts, Samurai"
3480,Nayuta,"Action, Sci-Fi, Shoujo"
3481,Grendizer: Getter Robo G - Great Mazinger Kessen! Daikaijuu,"Action, Mecha, Sci-Fi, Shounen"
3482,Madonna,"Sports, Comedy, School"
3483,Maison Ikkoku: Utsuriyuku Kisetsu no Naka de,"Comedy, Romance, Drama"
3484,Maison Ikkoku: Prelude - Meguru Haru no Sakura no you ni...,"Comedy, Romance, Drama"
3485,Ghost in the Shell: Stand Alone Complex 2nd GIG - Tachikoma na Hibi,"Comedy, Mecha, Sci-Fi"
3486,Yuusha Tokkyuu Might Gaine,"Action, Adventure, Mecha, Sci-Fi"
3488,Genji Monogatari,"Drama, Historical, Romance"
3490,Rayca,Sci-Fi
3493,Ryuusei no Rockman Tribe,Adventure
3496,Ougon no Hou: El Cantare no Rekishikan,"Historical, Fantasy"
3497,Steady x Study,Romance
3498,Shin Onimusha: Dawn of Dreams the Story,"Action, Historical, Demons, Martial Arts, Samurai"
3499,DinoZone,"Adventure, Sci-Fi, Shounen"
3500,"Yume Miru, Anime: on-chan",Comedy
3501,Wellber no Monogatari: Sisters of Wellber Zwei,"Adventure, Fantasy, Historical, Romance"
3503,Kanokon,"Comedy, Ecchi, Harem, Romance, School, Shounen, Slice of Life, Supernatural"
3505,Yuusha Shirei Dagwon,"Action, Adventure, Martial Arts, Mecha, Super Power, School"
3506,Connected,"Dementia, Music, Sci-Fi"
3507,Survival,"Dementia, Drama, Music, Psychological, School, Supernatural"
3508,Genius Party,"Action, Sci-Fi, Music, Dementia, Psychological, Romance, Fantasy, Mecha"
3509,Riki-Oh: Toukatsu Jigoku,"Action, Martial Arts, Super Power, Seinen"
3511,Riki-Oh 2: Horobi no Ko,"Action, Martial Arts, Super Power, Seinen"
3512,Tenshi Nanka ja Nai,"Comedy, Drama, Shoujo"
3513,Tanjou: Debut,"Slice of Life, Romance, Supernatural"
3514,Noramimi,Comedy
3515,Saint Seiya: Meiou Hades Elysion-hen,"Action, Fantasy, Shounen, Super Power"
3516,Hal & Bons,"Slice of Life, Comedy"
3517,New Hal & Bons,"Slice of Life, Comedy"
3518,Ginga no Uo Ursa Minor Blue,"Fantasy, Kids"
3519,Garakuta-doori no Stain,Comedy
3522,Choujin Locke,"Action, Sci-Fi, Super Power"
3525,Extra,"Action, Sci-Fi, Music, Dementia, Horror"
3533,Gakuentoshi Varanoir Joukan,"Action, Magic"
3535,Neko Ramen,Comedy
3545,Kochira Katsushikaku Kameari Kouenmae Hashutsujo (TV),"Slice of Life, Comedy, Police"
3546,Kochira Katsushikaku Kameari Kouenmae Hashutsujo,"Comedy, Police"
3547,Kochira Katsushikaku Kameari Kouenmae Hashutsujo The Movie 2: UFO Shuurai! Tornado Daisakusen,"Comedy, Police"
3549,Allison to Lillia,"Action, Adventure, Shounen"
3550,Midori no Makibao,"Sports, Comedy"
3561,Dennou Boukenki Webdiver,"Adventure, Mecha, Sci-Fi, Shounen"
3568,Ganbarist! Shun,"Comedy, Shounen, Sports"
3570,Yadosagashi,"Adventure, Fantasy, Kids, Slice of Life"
3571,Mach GoGoGo (1997),"Adventure, Cars"
3572,Macross F,"Action, Mecha, Military, Music, Romance, Sci-Fi, Space"
3573,Moegaku★5,"Magic, Parody"
3574,Switch,"Action, Mystery, Police"
3575,Sugai-kun to Kazoku Ishi The Movie,"Comedy, Parody"
3576,Kodai Ouja Kyouryuu King,"Adventure, Kids, Fantasy"
3577,Kyouran Kazoku Nikki,"Comedy, Sci-Fi"
3579,Getter Robo,"Action, Sci-Fi, Mecha, Shounen"
3588,Soul Eater,"Action, Fantasy, Comedy, Supernatural, Shounen"
3593,Utawarerumono OVA,"Action, Comedy, Fantasy"
3594,Tears to Tiara,"Action, Adventure, Fantasy, Magic"
3595,Kujakuou,"Action, Demons, Horror"
3596,Lightning Trap: Leina & Laika,"Action, Sci-Fi"
3597,Fantasia,"Fantasy, Magic, Comedy, Romance, Drama"
3599,Shin Kujakuou,"Action, Demons, Horror"
3600,Sengoku Kitan Youtouden,"Action, Demons, Martial Arts"
3602,Ginga Tetsudou 999: Eternal Fantasy,"Action, Drama, Sci-Fi, Space"
3603,JoJo no Kimyou na Bouken: Phantom Blood,"Action, Adventure, Horror, Shounen, Vampire"
3604,Hidamari Sketch x 365,"Slice of Life, Comedy, School, Seinen"
3605,Princess Army: Wedding★Combat,"Action, Martial Arts, Romance, Shoujo"
3609,Kikou Kantai Dairugger XV,"Action, Sci-Fi, Adventure, Space, Mecha, Shounen"
3613,Toshokan Sensou,"Action, Military, Comedy, Romance"
3614,Yakushiji Ryouko no Kaiki Jikenbo,"Mystery, Police, Supernatural"
3615,Neo Angelique Abyss,"Comedy, Fantasy, Harem, Romance, Shoujo"
3616,Kamen no Maid Guy,"Action, Comedy, Ecchi, Super Power"
3618,Moyashimon: Kin Gekijou Deluxe,Comedy
3619,Nanako SOS,"Comedy, Parody, Romance, Super Power"
3620,Blue Seed Omake,"Comedy, Parody"
3624,Seimei no Kagaku: Micro Patrol,Adventure
3625,Battle Royal High School,"Action, Horror, Super Power, Demons, Supernatural, Martial Arts"
3626,Mobile Suit Gundam Wing: Operation Meteor,"Action, Military, Sci-Fi, Adventure, Space, Psychological, Drama, Mecha"
3627,D.C.II S.S.: Da Capo II Second Season,"Fantasy, Comedy, Harem, Romance, Drama"
3630,Miracle Shoujo Limit-chan,"Comedy, Magic, School, Sci-Fi, Shoujo, Super Power"
3631,Aoi Blink,"Adventure, Fantasy"
3637,Bouken Yuuki Pluster World,"Action, Sci-Fi, Adventure, Shounen"
3638,Kaiketsu Zorori (TV),"Adventure, Comedy"
3640,Monkey Punch no Sekai: Alice,"Action, Comedy, Ecchi"
3641,Naisho no Tsubomi,"Kids, Romance, School, Shoujo, Slice of Life, Supernatural"
3642,Shina Dark: Kuroki Tsuki no Ou to Souheki no Tsuki no Himegimi,"Harem, Music, Ecchi, Fantasy, Seinen"
3646,Glass no Usagi,Historical
3652,Higurashi no Naku Koro ni Rei,"Mystery, Comedy, Psychological, Supernatural, Thriller"
3653,Kurogane no Linebarrels,"Action, Sci-Fi, Mecha"
3654,Macademi Wasshoi!,"Comedy, Ecchi, Fantasy, Romance, School, Supernatural"
3655,Nabari no Ou,"Action, Fantasy, Supernatural, Comedy, Drama, Shounen"
3656,Monochrome Factor,"Action, Shounen Ai, Supernatural"
3659,Majime ni Fumajime Kaiketsu Zorori: Nazo no Otakara Daisakusen,"Adventure, Comedy"
3660,Mahou no Idol Pastel Yumi,"Comedy, Fantasy, Kids, Magic, Shoujo"
3661,Joker: Marginal City,"Action, Sci-Fi, Romance"
3665,Ginga Eiyuu Densetsu Gaiden (1999),"Military, Sci-Fi, Space, Drama"
3667,Strike Witches,"Action, Military, Sci-Fi, Magic, Ecchi"
3668,Telepathy Shoujo Ran,"Fantasy, School"
3669,Duel Masters Movie 1: Yami no Shiro no Maryuuou,"Adventure, Kids"
3670,Kikou Souseiki Mospeada,"Action, Mecha, Military"
3671,"Genesis Climber Mospeada: Love, Live, Alive","Action, Mecha, Music"
3672,Tottemo! Luckyman,"Comedy, Super Power, Sci-Fi, Shounen"
3673,Nijuu Mensou no Musume,"Action, Adventure, Mystery"
3674,Sayonara Zetsubou Sensei Jo: Zetsubou Shoujo Senshuu,"Comedy, Parody, School"
3675,Andromeda Stories,"Action, Drama, Fantasy, Sci-Fi, Space"
3676,Machine Robo: Cronos no Dai Gyakushuu,"Action, Sci-Fi, Space, Mecha"
3683,Kabatotto,Comedy
3684,Dimension Loop,Sci-Fi
3685,4-Day Weekend,Music
3686,Tokimeki Memorial: Only Love Specials,"Comedy, School"
3689,Hatsumei Boy Kanipan,"Sci-Fi, Adventure, Comedy, Mecha"
3690,Chou Hatsumei Boy Kanipan,"Adventure, Comedy, Mecha, Romance"
3691,Watashi to Watashi: Futari no Lotte,"Slice of Life, Kids, Shoujo"
3692,Yes! Precure 5 GoGo!,"Action, Magic, Fantasy, School, Shoujo"
3695,Spectral Force Chronicle Divergence,Fantasy
3701,Kaiba,"Adventure, Mystery, Romance, Sci-Fi"
3702,Detroit Metal City,"Music, Comedy"
3704,Zenryoku Usagi,"Comedy, Kids"
3710,Hakaba Kitarou,"Horror, Supernatural"
3712,Zero no Tsukaima: Princesses no Rondo,"Action, Adventure, Harem, Comedy, Magic, Romance, Ecchi, Fantasy, School"
3713,Jigoku Shoujo Mitsuganae,"Mystery, Psychological, Supernatural"
3720,Jack to Mame no Ki,"Fantasy, Kids"
3723,Koala Boy Kokki,Comedy
3724,Taiko no Tatsujin,Game
3726,Karasu Tengu Kabuto: Ougon no Me no Kemono,"Action, Adventure, Drama, Historical"
3727,Doraemon Movie 01: Nobita no Kyouryuu,"Adventure, Comedy"
3731,Itazura na Kiss,"Comedy, Romance, Shoujo"
3734,Glass no Kamen: Sen no Kamen wo Motsu Shoujo,"Drama, Shoujo"
3735,Ryuuseiki Gakusaver,"Action, Sci-Fi, Space, Comedy, Parody, Mecha, School"
3736,Parappa the Rapper,"Comedy, Fantasy"
3737,Usavich,"Adventure, Comedy"
3738,Usavich II,"Adventure, Comedy"
3743,Murder,"Parody, Mystery, Vampire"
3744,Crayon Shin-chan Movie 10: Arashi wo Yobu Appare! Sengoku Daikassen,"Historical, Drama, Romance, Samurai, Seinen"
3745,Crayon Shin-chan Movie 02: Buriburi Oukoku no Hihou,"Action, Adventure, Comedy, Seinen"
3750,Maria-sama ga Miteru 4th,"School, Shoujo, Shoujo Ai, Slice of Life"
3751,Sekai Meisaku Douwa: Mori wa Ikiteiru,"Fantasy, Kids"
3752,Nagagutsu wo Haita Neko: 80 Nichikan Sekai Isshuu,"Adventure, Kids"
3754,Tongari Boushi no Memole,"Fantasy, Magic, Shoujo"
3755,Sekai Meisaku Douwa: Oyayubi Hime,"Fantasy, Kids"
3757,Sekai Meisaku Douwa: Aladdin to Mahou no Lamp,"Adventure, Fantasy"
3758,Panda no Daibouken,Adventure
3759,School Days: Valentine Days,"Comedy, Romance, School"
3760,Grimm Douwa: Kin no Tori,"Adventure, Fantasy"
3761,Wanwan Sanjuushi,"Adventure, Historical"
3762,The Borgman: Last Battle,"Action, Sci-Fi, Demons"
3763,Chouon Senshi Borgman: Lovers Rain,"Action, Sci-Fi, Demons"
3764,Chouon Senshi Borgman 2: Shin Seiki 2058,"Action, Demons, Sci-Fi, Shounen"
3765,Pygmalio,"Adventure, Fantasy, Shoujo"
3768,Play Ball,"Action, Sports, Shounen"
3769,Play Ball 2nd,"Action, Sports, Shounen"
3772,Saiko Robot Kombock,"Mecha, Sci-Fi"
3776,Go! Go! Itsutsugo Land,School
3778,Yuukan Club,"Mystery, Comedy, School, Shoujo"
3782,Kara no Kyoukai 2: Satsujin Kousatsu (Zen),"Action, Mystery, Supernatural, Romance, Thriller"
3783,Kara no Kyoukai 3: Tsuukaku Zanryuu,"Action, Mystery, Supernatural, Drama, Thriller"
3784,Evangelion: 2.0 You Can (Not) Advance,"Action, Sci-Fi, Mecha"
3785,Evangelion: 3.0 You Can (Not) Redo,"Action, Sci-Fi, Mecha"
3787,The Choujo,"Comedy, Sci-Fi, Super Power"
3791,Air Gear Special,"Sports, Shounen"
3799,Speed,Comedy
3800,Arrow Emblem Grand Prix no Taka,"Cars, Sports, Drama"
3801,Yami no Teio: Kyuuketsuki Dracula,Vampire
3805,Kaitou Tenshi Twin Angel,Magic
3806,Sasuga no Sarutobi,"Action, Adventure, Comedy, Martial Arts, Romance, Sports"
3807,Honoo no Alpenrose: Judy & Randy,"Historical, Drama, Romance, Shoujo"
3808,Futari Daka,"Cars, Sports, Shounen"
3809,Shirayuki Hime no Densetsu,"Adventure, Fantasy, Romance"
3810,Mori no Youki na Kobito-tachi: Belfy to Lillibit,"Adventure, Fantasy, Comedy"
3811,Hoshi no Oujisama Petit Prince,Adventure
3812,Yume no Hoshi no Button Nose,"Kids, Adventure"
3813,Gekkou no Pierce: Yumemi to Gin no Bara no Kishidan,"Fantasy, Mystery, Romance, Shoujo"
3816,Idol Fight Suchie-Pai 2,"Action, Ecchi"
3817,Space Travelers The Animation,"Sci-Fi, Space"
3818,Soratobu Toshi Keikaku,"Sci-Fi, Music, Space"
3819,Sasurai no Taiyou,"Music, Drama"
3820,Space Station No.9,"Sci-Fi, Music, Space"
3821,Portable Kuukou,"Sci-Fi, Music, Space"
3822,Sougen no Shoujo Laura,"Adventure, Shoujo"
3823,Little Lulu to Chicchai Nakama,"Kids, Slice of Life, Comedy"
3825,Dokaben,"Action, Sports, School, Shounen"
3827,Ore wa Teppei,"Action, Shounen, Sports"
3828,Maegami Tarou,Adventure
3829,Anne no Nikki,"Drama, Historical"
3832,Rebirth Moon Divergence,"Action, Fantasy"
3834,Hoshi no Ko Chobin,"Adventure, Sci-Fi"
3835,Ai no Gakkou Cuore Monogatari,"Slice of Life, Historical, Drama, School"
3836,Meiken Jolie,"Adventure, Historical"
3837,Mashin Eiyuuden Wataru,"Adventure, Comedy, Mecha, Sci-Fi, Shounen"
3838,Himitsu no Akko-chan 2,"Magic, School, Shoujo"
3839,Himitsu no Akko-chan 3,"Magic, School, Shoujo"
3840,Crystal Blaze,"Action, Sci-Fi"
3841,Chi&#039;s Sweet Home,"Comedy, Slice of Life"
3842,Doubutsu Takarajima,Adventure
3843,Ali Baba to 40-hiki no Touzoku,"Action, Fantasy"
3844,Apache Yakyuugun,"Action, Sports, School"
3845,Mahoutsukai Chappy,"Adventure, Kids, Magic"
3846,Microid S,"Action, Sci-Fi"
3847,Sekai Meisaku Douwa: Hakuchou no Ouji,Fantasy
3848,"One Piece Movie 9: Episode of Chopper Plus - Fuyu ni Saku, Kiseki no Sakura","Action, Adventure, Comedy, Super Power, Fantasy, Shounen"
3849,The SoulTaker: Tamashii-gari - Komugi Daisakusen,Comedy
3853,Crayon Shin-chan Manatsu no Yoru ni Ora Sanjou! Arashi wo Yobu Den-O vs. Shin-O 60-bu Special!!,"Action, Comedy, Super Power, Seinen"
3854,Ginga Tetsudou Monogatari: Wasurerareta Toki no Wakusei,"Drama, Sci-Fi, Space"
3858,Konchuu Monogatari Minashigo Hutch,"Adventure, Comedy, Drama"
3859,Top Secret: The Revelation,"Sci-Fi, Mystery, Police, Psychological, Shoujo"
3861,Shaman King Specials,"Action, Comedy, Supernatural, Shounen"
3863,Sweet Valerian Specials,"Comedy, Magic, Shoujo"
3864,Souten no Ken Specials,"Action, Martial Arts, Historical, Shounen"
3866,Kuro ga Ita Natsu,"Historical, Drama"
3868,Versailles no Bara: Seimei Aru Kagiri Aishite,"Historical, Drama, Romance, Shoujo"
3869,Sakura Momoko Gekijou: Coji-Coji,"Fantasy, Comedy"
3870,Kick no Oni,"Shounen, Sports"
3873,Honey Honey no Suteki na Bouken,"Adventure, Historical, Shoujo"
3874,Ashita e Free Kick,Sports
3875,Mahoutsukai Sally 2,"Comedy, Magic, Shoujo"
3876,Maeterlinck no Aoi Tori: Tyltyl Mytyl no Bouken Ryokou,"Adventure, Fantasy"
3877,Sasurai no Shoujo Nell,"Adventure, Historical, Shoujo"
3878,Mahou Shoujo Lalabel,"Slice of Life, Magic, Comedy, Shoujo"
3879,Paris no Isabelle,"Historical, Drama"
3880,Makyou Densetsu Acrobunch,"Mecha, Sci-Fi, Shounen"
3881,Majokko Tickle,"Magic, Comedy, Shoujo"
3882,Seijuuki Cyguard,"Mecha, Sci-Fi, Supernatural"
3884,Maze☆Bakunetsu Jikuu: Hot Springs,"Action, Comedy, Ecchi, Fantasy"
3885,Sugar Bunnies,Kids
3886,Super Mario Brothers: Peach-hime Kyuushutsu Daisakusen!,"Adventure, Comedy, Shounen"
3887,Ookiku Furikabutte Special,"Drama, Sports"
3889,Junk Boy,"Comedy, Romance, Ecchi"
3898,Mazinger Z tai Devilman,"Adventure, Demons, Mecha, Sci-Fi, Shounen"
3900,Ougon Bat,"Action, Sci-Fi, Super Power"
3901,Baccano! Specials,"Action, Mystery, Comedy, Historical, Supernatural"
3905,Wanpaku Ouji no Orochi Taiji,Adventure
3906,H. P. Lovecraft&#039;s The Dunwich Horror and Other Stories,Horror
3907,Ginga Sengoku Gunyuuden Rai,"Sci-Fi, Adventure, Space, Romance, Shounen"
3909,Bikkuriman,"Comedy, Fantasy"
3913,Onikirimaru,"Action, Demons, Martial Arts, Shounen"
3914,1001 Nights,"Demons, Fantasy, Romance, Seinen"
3915,Time Bokan,"Adventure, Comedy, Mecha"
3923,Kamen Rider Den-O: Imagin Anime,"Action, Adventure, Comedy, Kids, Super Power"
3927,Mobile Suit Gundam 00 Second Season,"Action, Military, Sci-Fi, Space, Drama, Mecha"
3929,Ugokie Kori no Tatehiki,"Comedy, Supernatural"
3930,Issunboushi no Shusse,Supernatural
3931,Initial D Battle Stage 2,"Action, Cars, Sports, Drama, Seinen"
3932,Magnerobo Ga-Keen,"Action, Mecha, Sci-Fi"
3935,Karakuri Kiden: Hiwou Senki,"Action, Adventure, Mecha, Historical"
3936,Personal Computer Travel Tanteidan,"Kids, Adventure, Historical, Sci-Fi"
3937,Takoyaki Mant-Man,"Comedy, Sci-Fi"
3946,Jarinko Chie,"Slice of Life, Comedy, Drama, Seinen"
3947,Jarinko Chie (TV),"Slice of Life, Comedy, Drama, Seinen"
3948,Mahou Sensei Negima! Introduction Film,"Action, Ecchi, Comedy, Harem, Romance, Supernatural"
3952,Blue Seed 1.5,"Comedy, Romance, Sci-Fi"
3954,Tales of Symphonia The Animation: Kratos-sensei no Private Lesson,"Comedy, School"
3956,Shakugan no Shana II (Second) Specials,"Comedy, Parody"
3958,Kannagi,"Comedy, School, Shounen, Supernatural"
3960,Armored Core: Fort Tower Song,"Action, Mecha, Sci-Fi"
3962,Chocolate Underground,"Comedy, Kids"
3963,Turn A Gundam I Movie: Earth Light,"Action, Drama, Mecha, Military, Sci-Fi, Space"
3964,Turn A Gundam II Movie: Moonlight Butterfly,"Action, Drama, Mecha, Military, Sci-Fi, Space"
3965,Nodame Cantabile Special,"Slice of Life, Comedy, Romance, Josei"
3968,Dragoon,"Adventure, Fantasy"
3969,Kagaku Kyuujo-tai TechnoVoyager,"Action, Adventure, Mecha, Sci-Fi, Space"
3972,Yu☆Gi☆Oh! 5D&#039;s,"Action, Game, Shounen"
3973,Ikuze! Gen-san,Comedy
3974,Tetsuwan Birdy Decode,"Action, Sci-Fi, Comedy"
3975,Uchi no 3 Shimai,"Comedy, Slice of Life"
3977,To Heart Omake,"Slice of Life, Comedy, Harem, School"
3989,Suna no Bara: Yuki no Mokushiroku,Action
3990,Kumo to Tulip,Adventure
3991,Mahou Shoujo-tai Arusu the Adventure,"Adventure, Comedy, Fantasy, Magic"
4003,Dream Hunter Rem,"Mystery, Magic, Ecchi"
4012,First Squad,"Action, Music"
4013,Paul no Miracle Daisakusen,"Action, Adventure, Kids"
4014,Choujin Locke: Lord Leon,"Action, Sci-Fi, Super Power"
4015,School Rumble San Gakki,"Comedy, Romance, School, Shounen"
4021,Seiyou Kottou Yougashiten: Antique,"Comedy, Shoujo, Shounen Ai"
4023,Kitty&#039;s Paradise,"Fantasy, Kids"
4024,Sanrio Anime Sekai Meisaku Gekijou,"Adventure, Fantasy, Kids"
4025,Asobou! Hello Kitty,"Adventure, Fantasy, Kids"
4026,Pokemon Diamond & Pearl: Giratina to Sora no Hanataba Sheimi,"Action, Adventure, Fantasy, Kids"
4028,Slayers Revolution,"Adventure, Comedy, Fantasy"
4031,Sakigake!! Otokojuku Movie,"Action, Comedy, Martial Arts, School, Shounen"
4033,The iDOLM@STER Live For You!,"Comedy, Drama, Music"
4037,Cowboy Bebop: Yose Atsume Blues,"Action, Adventure, Comedy, Drama, Sci-Fi, Space"
4038,Zettai Karen Children,"Action, Comedy, Supernatural, Shounen"
4039,Golgo 13 (TV),"Action, Adventure, Drama, Thriller, Seinen"
4042,Hanappe Bazooka,"Action, Comedy, Ecchi, Magic, School"
4044,Youkai Ningen Bem,"Horror, Demons"
4049,Mafukiden: Pandarian,"Adventure, Comedy, Fantasy, Kids, Magic, Super Power"
4050,Kouchuu Ouja Mushiking: Mori no Tami no Densetsu,Fantasy
4051,Net Ghost Pipopa,"Action, Adventure, Comedy, Kids, Sci-Fi, Shounen"
4052,Medarot Damashii,"Action, Sci-Fi, Adventure"
4053,Tennis no Ouji-sama: Zenkoku Taikai-hen - Final,"Comedy, Sports, School, Shounen"
4054,Norimono Oukoku BuBu ChaCha,"Slice of Life, Comedy"
4056,Masuda Kousuke Gekijou Gag Manga Biyori 3,Comedy
4058,Makyou Gaiden Le Deus,"Action, Adventure, Mecha, Sci-Fi"
4059,"Clannad: Mou Hitotsu no Sekai, Tomoyo-hen","Drama, Romance, School, Slice of Life"
4060,Grimm Masterpiece Theater,"Adventure, Comedy, Kids, Magic, Fantasy"
4061,Grimm Masterpiece Theater II,"Adventure, Comedy, Fantasy, Kids, Magic"
4062,Musashi no Ken,"Shounen, Sports"
4063,Sekirei,"Action, Comedy, Ecchi, Harem, Super Power"
4066,Tytania,"Adventure, Military, Psychological, Romance, Sci-Fi, Space"
4067,Shin Megami Tensei Devil Children,"Action, Adventure, Demons, Fantasy, Game, Kids, Magic, Sci-Fi, Supernatural"
4068,Shin Megami Tensei Devil Children: Light & Dark,"Action, Kids, Adventure, Fantasy, Magic, Game, Supernatural, Demons, Sci-Fi"
4069,Pucca,"Comedy, Romance"
4070,Black Jack: Dr. Pinoko no Mori no Bouken,Comedy
4071,Black Jack (TV): Hizouban Specials,Adventure
4073,Kyouryuu Daisensou Aizenborg,"Action, Mecha"
4074,"Arano no Sakebi Koe: Hoero, Buck","Adventure, Drama"
4075,Super Robot Taisen OG: Divine Wars Special,"Action, Comedy, Mecha"
4078,Kyou no 5 no 2 Kagai Jugyou: Mizukake,"Comedy, Ecchi, School, Seinen"
4080,Kyou kara Maou! 3rd Series,"Adventure, Comedy, Demons, Fantasy, Shoujo"
4081,Natsume Yuujinchou,"Slice of Life, Supernatural, Drama, Fantasy, Shoujo"
4082,Kaibutsu Oujo: Konsui Oujo,"Action, Comedy, Horror, Supernatural, Vampire, Shounen"
4083,Wonder Beat Scramble,"Action, Space, Sci-Fi"
4085,Yonimo Osoroshii Grimm Douwa,"Dementia, Horror, Psychological"
4086,Muka Muka Paradise,"Adventure, Comedy"
4087,Michiko to Hatchin,"Action, Adventure"
4088,Wonder 3,"Action, Adventure, Comedy, Sci-Fi"
4091,Kagami no Genon,Slice of Life
4094,Batman: Gotham Knight,"Action, Adventure, Martial Arts"
4095,Chuumon no Ooi Ryouriten (1991),"Horror, Supernatural, Fantasy"
4096,Mizu no Tane,Historical
4097,Nanmu Ichibyousokusai,"Historical, Music"
4098,Urarochi Diamond,Adventure
4099,Appaga Piryohae,Fantasy
4101,Wan Wan Celepoo Soreyuke! Tetsunoshin,"Comedy, Fantasy, Kids"
4103,Oval x Over,Cars
4104,Mini Moni the TV,Comedy
4106,Trigun: Badlands Rumble,"Action, Sci-Fi, Adventure, Comedy, Drama, Shounen"
4107,Tengen Toppa Gurren Lagann Movie 1: Gurren-hen,"Action, Comedy, Mecha"
4112,Mouse and His Child,Adventure
4113,Mahou no Mako-chan,"Fantasy, Magic, Romance, Shoujo"
4114,Onegai My Melody: Kuru Kuru Shuffle!,"Fantasy, Magic, Comedy"
4119,Juushin Liger,"Action, Mecha, Sci-Fi"
4121,Meimon! Daisan Yakyuubu,"Action, Sports, Shounen"
4124,Futari wa Precure: Splash☆Star Movie - Tick Tack Kiki Ippatsu!,"Magic, Fantasy, Kids, Shoujo"
4126,Mahou no Tenshi Creamy Mami: Lovely Serenade,Music
4129,Mahou no Tenshi Creamy Mami: Curtain Call,"Music, Comedy, Shoujo"
4130,Petit Eva: Evangelion@School,"Comedy, Parody, School"
4131,Twin Bee Paradise,"Action, Adventure"
4132,Wakakusa no Yon Shimai,"Slice of Life, Historical, Drama"
4134,"Naruto Shippuuden: Shippuu! ""Konoha Gakuen"" Den",Comedy
4136,Penguin Musume♥Heart,"Comedy, Ecchi, School, Slice of Life"
4138,Chiisana Pengin: Lolo no Bouken,"Adventure, Slice of Life, Kids, Drama, Fantasy"
4147,Gang-aji Ttong,"Kids, Fantasy"
4150,Cosmos Pink Shock,"Comedy, Parody, Sci-Fi, Space"
4151,Blade of the Immortal,"Action, Adventure, Historical, Samurai, Supernatural"
4154,Time Bokan Series: Yattodetaman,"Action, Adventure, Comedy, Fantasy, Mecha"
4155,One Piece Film: Strong World,"Action, Adventure, Comedy, Drama, Fantasy, Shounen"
4156,Ichigo Mashimaro Episode 0,Comedy
4158,Dore Dore no Uta,Music
4162,Taiho Shichau zo: Nagisa no Koutsuu Yuudou,"Action, Police, Comedy, Seinen"
4163,Seto no Hanayome OVA,"Comedy, Parody, Romance, School"
4166,To Heart 2 AD,"Comedy, Ecchi, Romance"
4173,Shigofumi Picture Drama,Comedy
4176,Wanna-Be&#039;s,"Action, Comedy, Sports"
4177,Bounen no Xamdou,"Action, Military, Sci-Fi"
4181,Clannad: After Story,"Slice of Life, Comedy, Supernatural, Drama, Romance"
4182,Darker than Black: Kuro no Keiyakusha - Sakura no Hana no Mankai no Shita,"Sci-Fi, Comedy, Parody"
4183,Uchuu Taitei God Sigma,"Action, Space, Mecha"
4186,Chrome Shelled Regios,"Action, Adventure, Fantasy, School, Sci-Fi"
4187,Megumi,Historical
4188,Mahou Sensei Negima! Shiroki Tsubasa Ala Alba,"Adventure, Comedy, Ecchi, Harem, Magic, Romance, Shounen, Supernatural, Vampire"
4189,Winter Sonata,"Drama, Romance"
4190,Harukanaru Toki no Naka de 3: Kurenai no Tsuki Special,"Fantasy, Comedy, Shoujo"
4191,Popolocrois Monogatari,"Adventure, Fantasy"
4192,Hayate no Gotoku!!,"Action, Harem, Comedy, Parody, Romance, Shounen"
4195,Kodomo no Jikan: Ni Gakki,"Comedy, Ecchi, School"
4196,Ikkitousen: Great Guardians,"Action, Ecchi, Martial Arts, School, Super Power"
