animeid,title,genres
11569,Precure All Stars DX the Dance Live♥: Miracle Dance Stage e Youkoso,"Fantasy, Magic, Music, Shoujo"
11577,Steins;Gate Movie: Fuka Ryouiki no Déjà vu,"Sci-Fi, Drama"
11579,Jubilee,"Dementia, Music"
11583,Kami nomi zo Shiru Sekai: Natsu-iro Surprise,Music
11589,Puu-Neko Shougekijou,Comedy
11593,Ganbare! Bokura no Hit and Run,"School, Sports"
11595,Perman (1983),"Kids, Comedy, Super Power, School"
11597,Nisemonogatari,"Mystery, Comedy, Supernatural, Ecchi"
11609,"Shuukan Shimakou: Sono Toki, Shimakou ga Ugoita!",Comedy
11611,Shuukan Shimakou Special,Comedy
11615,Morita-san wa Mukuchi. 2,"Comedy, School, Slice of Life"
11617,High School DxD,"Comedy, Demons, Ecchi, Harem, Romance, School"
11625,Donbe Monogatari,Kids
11633,Blood Lad,"Action, Comedy, Demons, Seinen, Supernatural, Vampire"
11635,Sacred Seven: Shirogane no Tsubasa,"Action, School, Sci-Fi, Super Power"
11659,Pink Mizu Dorobou Ame Dorobou,"Action, Comedy, Fantasy, Shounen"
11661,Robo to Shoujo (Kari),"Action, Comedy, Mecha, Sci-Fi"
11663,Hakuouki OVA,"Action, Historical, Supernatural, Drama, Samurai"
11665,Natsume Yuujinchou Shi,"Slice of Life, Supernatural, Drama, Fantasy, Shoujo"
11673,Hal no Fue,"Kids, Adventure"
11679,Chainsaw Maid,"Comedy, Horror, Supernatural, Thriller"
11681,Tetsu no Ko Kanahiru,Fantasy
11685,Takarajima Memorial: Yuunagi to Yobareta Otoko,"Adventure, Drama, Historical, Mystery, Supernatural"
11687,Pussycat,"Fantasy, Horror"
11689,CCW: Crazy Clay Wrestling,Sports
11691,Bloody Date,Horror
11693,Match Uri no Shoujo,"Drama, Kids"
11695,Ultraman Graffiti,"Action, Comedy, Parody, Super Power"
11697,Area no Kishi,"Comedy, School, Shounen, Sports"
11699,Yurumates wa?,"Comedy, Seinen, Slice of Life"
11701,Another: The Other - Inga,"Horror, Mystery, Thriller"
11703,Code:Breaker,"Action, Comedy, School, Shounen, Super Power, Supernatural"
11705,Dragon Age: Blood Mage no Seisen,"Action, Fantasy"
11711,Me wo Samase Toragorou,Kids
11713,Suisenzuki no Yokka,"Fantasy, Kids"
11715,Kamisama Dolls Specials,Comedy
11717,Hoshi no Kirby: Pilot,"Adventure, Comedy, Parody, Fantasy"
11729,Space Neko Theater,Comedy
11731,Chi-Sui Maru Specials,Comedy
11733,Chi-Sui Maru 2nd Season,Comedy
11735,Coluboccoro,"Sci-Fi, Fantasy"
11737,Ao no Exorcist Movie,"Action, Demons, Fantasy, Shounen, Supernatural"
11739,Kimi to Boku. 2,"Comedy, Drama, Romance, School, Shounen, Slice of Life"
11741,Fate/Zero 2nd Season,"Action, Supernatural, Magic, Fantasy"
11743,Toaru Majutsu no Index Movie: Endymion no Kiseki,"Action, Sci-Fi, Super Power, Magic"
11751,Senki Zesshou Symphogear,"Action, Sci-Fi, Music"
11755,009 Re:Cyborg,"Action, Adventure, Mecha, Sci-Fi"
11757,Sword Art Online,"Action, Adventure, Fantasy, Game, Romance"
11759,Accel World,"Action, Game, Sci-Fi, Romance, School"
11761,Medaka Box,"Action, Comedy, Ecchi, Martial Arts, School, Shounen, Super Power"
11763,Sekai de Ichiban Tsuyoku Naritai!,"Action, Ecchi, Sports"
11767,Justeen,"Action, Mecha, Sci-Fi"
11769,Gokujo.: Gokurakuin Joshikou Ryou Monogatari,"Comedy, Ecchi, School, Seinen, Shoujo Ai"
11771,Kuroko no Basket,"Comedy, School, Shounen, Sports"
11773,To Heart 2: Dungeon Travelers,"Adventure, Comedy, Ecchi, Fantasy, Magic, Seinen"
11777,Lupin III: Chi no Kokuin - Eien no Mermaid,"Action, Adventure, Comedy, Seinen"
11783,Dog Days&#039;,"Action, Adventure, Magic, Fantasy"
11785,Haiyore! Nyaruko-san,"Sci-Fi, Comedy, Parody"
11787,Toriko: Barbarian Ivy wo Hokaku Seyo!,"Action, Super Power, Adventure, Comedy, Shounen"
11789,Wish Me Mell,"Fantasy, Kids, Magic"
11791,Sore Ike! Anpanman: Ruby no Negai,"Comedy, Kids, Magic"
11793,"Tamayura: Hitotose - Attakai Kaze no Omoide, Nanode","Comedy, Drama, Slice of Life"
11795,Forsaken,"Music, Vampire"
11799,Midori no Neko,Mystery
11809,gdgd Fairies,Comedy
11813,Shijou Saikyou no Deshi Kenichi OVA,"Action, Martial Arts, Comedy, School, Shounen"
11829,Manga Mitokoumon,Historical
11835,Qin Shi Ming Yue: Zhu Zi Bai Jia,"Action, Historical, Martial Arts, Fantasy"
11837,Zetman,"Action, Drama, Horror, Romance, Sci-Fi, Seinen, Supernatural"
11841,Qin Shi Ming Yue: Ye Jin Tianming,"Action, Historical, Martial Arts, Fantasy"
11843,Danshi Koukousei no Nichijou,"Slice of Life, Comedy, School"
11853,Pokemon: Pikachu no Summer Bridge Story,"Adventure, Comedy, Fantasy, Kids"
11857,Judo Sanka,"Sports, Shounen"
11859,Queen&#039;s Blade: Rebellion,"Action, Adventure, Ecchi, Fantasy"
11867,Cipher,"Drama, Music"
11869,Bloody Night,"Horror, Psychological, Supernatural, Thriller"
11873,Oraa Guzura Dado (1987),"Comedy, Kids"
11883,Nendo no Tatakai 2,"Comedy, Fantasy"
11887,Kokoro Connect,"Slice of Life, Comedy, Supernatural, Drama, Romance, School"
11889,The iDOLM@STER: 765 Pro to Iu Monogatari,"Music, Comedy, Drama"
11897,Nendo no Tatakai,"Comedy, Fantasy"
11911,Pretty Rhythm: Aurora Dream - Prism Shougekijou,"Comedy, Shoujo"
11915,Within the Bloody Woods,Horror
11917,Major: World Series,"Comedy, Drama, Sports"
11919,Zoku Attacker You! Kin Medal e no Michi,"Sports, Romance"
11933,Oda Nobuna no Yabou,"Comedy, Historical, Romance"
11959,Moeru! Oniisan (OVA),Comedy
11977,Mahou Shoujo Madoka★Magica Movie 1: Hajimari no Monogatari,"Psychological, Drama, Magic, Thriller"
11979,Mahou Shoujo Madoka★Magica Movie 2: Eien no Monogatari,"Drama, Magic, Psychological, Thriller"
11981,Mahou Shoujo Madoka★Magica Movie 3: Hangyaku no Monogatari,"Psychological, Drama, Magic, Thriller"
11995,Guilstein,"Action, Horror, Sci-Fi"
12001,One Piece 3D: Gekisou! Trap Coaster,"Action, Adventure, Fantasy, Comedy, Shounen"
12005,What&#039;s Michael?,Comedy
12015,Tiger & Bunny Movie 1: The Beginning,"Action, Super Power, Comedy, Mystery"
12017,Tiger & Bunny Movie 2: The Rising,"Action, Mystery, Comedy, Super Power"
12021,Poyopoyo Kansatsu Nikki,"Slice of Life, Comedy, Seinen"
12027,Anne no Nikki: Anne Frank Monogatari,"Drama, Historical"
12029,Uchuu Senkan Yamato 2199,"Action, Military, Sci-Fi, Space, Drama"
12031,Kingdom,"Action, Historical, Military, Seinen"
12035,Dwaejiui Wang,"Drama, Psychological, Seinen, Thriller"
12037,What&#039;s Michael? 2,Comedy
12039,What&#039;s Michael? (TV),Comedy
12049,Fairy Tail Movie 1: Houou no Miko,"Action, Adventure, Fantasy, Magic, Comedy, Shounen"
12053,Mardock Scramble: The Third Exhaust,"Action, Psychological, Sci-Fi"
12065,Queen&#039;s Blade OVA Specials,"Action, Adventure, Ecchi, Fantasy"
12067,Rurouni Kenshin Special,"Action, Historical, Romance, Samurai"
12069,Hajime no Ippo: Boxer no Kobushi,"Comedy, Drama, Shounen, Sports"
12079,Black★Rock Shooter,"Action, Music"
12101,Mahou Shoujo Lyrical Nanoha: Lyrical Toy Box,"Magic, Music"
12113,Berserk: Ougon Jidai-hen II - Doldrey Kouryaku,"Action, Adventure, Demons, Drama, Fantasy, Horror, Military, Seinen, Supernatural"
12115,Berserk: Ougon Jidai-hen III - Kourin,"Action, Adventure, Demons, Drama, Fantasy, Horror, Military, Seinen, Supernatural"
12117,Detective Conan Movie 16: The Eleventh Striker,"Adventure, Comedy, Mystery, Police, Shounen, Sports"
12119,Natsu-iro Kiseki,"School, Slice of Life, Supernatural"
12121,Towa no Kizuna,Music
12123,Yurumates 3D,"Slice of Life, Comedy, Seinen"
12131,30-sai no Hoken Taiiku Specials,"Ecchi, Parody, Romance, Seinen"
12133,Sekaikei Sekai Ron,"Sci-Fi, Psychological"
12135,Ra/Radio Noise*Planet,"Adventure, Psychological, Sci-Fi"
12137,Robotica*Robotics,"Slice of Life, Psychological, Sci-Fi, Shounen Ai"
12139,Wanpaku Tanteidan,"Action, Mystery"
12141,Kaze no Matasaburou,"Slice of Life, Kids, Fantasy"
12145,Backkom,"Comedy, Kids"
12149,AKB0048,"Music, Sci-Fi"
12157,Busou Chuugakusei: Basket Army,"Action, Military"
12163,Ginga Tetsudou 999: Hoshizora wa Time Machine,"Drama, Sci-Fi"
12165,Niji no Kanata e! Shoujo Diana Monogatari,"Historical, Shoujo"
12175,Koi to Senkyo to Chocolate,"Drama, Romance, School"
12181,Nihon Omoshiro Mukashibanashi,"Comedy, Historical, Parody"
12185,Mameushi-kun,"Comedy, Fantasy, Kids"
12187,Carnival Phantasm EX Season,"Comedy, Supernatural"
12189,Hyouka,"Mystery, School, Slice of Life"
12191,Smile Precure!,"Action, Fantasy, Magic, Shoujo"
12221,Precure All Stars Movie New Stage: Mirai no Tomodachi,"Fantasy, Magic, Shoujo"
12223,s.CRY.ed Alteration II: Quan,"Action, Sci-Fi, Adventure, Super Power, Shounen"
12225,Galaxy Angel S,"Sci-Fi, Comedy"
12231,Dragon Ball: Episode of Bardock,"Action, Sci-Fi, Adventure, Comedy, Super Power, Martial Arts, Fantasy, Shounen"
12237,Koi-ken!: Watashitachi Anime ni Nacchatta!,"Ecchi, Music"
12243,Game Center Arashi,"Comedy, Game, Kids, Shounen"
12255,Carnival Phantasm: Illya-jou,"Parody, Comedy"
12259,Mikeneko Holmes no Yuurei Joushu,"Comedy, Drama, Mystery"
12267,Takara-sagashi,"Adventure, Fantasy, Kids"
12279,Kinnikuman II Sei: Muscle Ninjin Soudatsu sen! Choujin Daisensou,"Action, Comedy, Drama, Romance, Martial Arts, Samurai"
12281,Rinne no Lagrange Season 2,"Action, Comedy, Mecha, Sci-Fi"
12291,Acchi Kocchi (TV),"Slice of Life, Comedy, Romance, School, Seinen"
12293,Campione!: Matsurowanu Kamigami to Kamigoroshi no Maou,"Comedy, Ecchi, Fantasy, Harem, Magic, Romance"
12295,Tobacco to Hai,Adventure
12317,Upotte!!,"Action, Comedy, Military, Seinen"
12321,Thermae Romae,"Comedy, Historical, Seinen"
12337,Soukou Kihei Votoms Recaps,"Action, Drama, Mecha, Military, Sci-Fi"
12341,Trip Trek,"Adventure, Fantasy, Comedy"
12343,Dirty Pair Flash 2,"Action, Sci-Fi, Adventure, Comedy, Police"
12347,Dirty Pair Flash 3,"Action, Sci-Fi, Adventure, Comedy, Police"
12351,eX-Driver the Movie Specials,Comedy
12355,Ookami Kodomo no Ame to Yuki,"Slice of Life, Fantasy"
12359,Pecola,Kids
12361,Track City,"Action, Cars"
12365,Bakuman. 3rd Season,"Comedy, Drama, Romance, Shounen"
12367,Shining Hearts: Shiawase no Pan,"Action, Fantasy"
12371,Bosco no Mori no Nakama-tachi,"Adventure, Fantasy"
12391,Mouretsu Atarou (1990),"Comedy, Kids, Slice of Life"
12393,Oyako Club,"Slice of Life, Comedy"
12399,Touyama Sakura Uchuu Chou: Yatsu no Na wa Gold,"Action, Sci-Fi"
12401,The Gakuen Choujo-tai,"Action, Demons, Shoujo, Super Power"
12403,Yuru Yuri♪♪,"Slice of Life, Comedy, School, Shoujo Ai"
12411,UN-GO: Inga Nikki,Parody
12413,Jormungand,"Action, Adventure, Seinen"
12419,Guilty Crown Kiseki: Reassortment,"Action, Sci-Fi, Super Power"
12429,Last Exile: Ginyoku no Fam Recaps,"Action, Adventure, Sci-Fi"
12431,Uchuu Kyoudai,"Comedy, Sci-Fi, Seinen, Slice of Life, Space"
12433,Kyokugen Dasshutsu Adv: Zennin Shibou Desu Prologue,Mystery
12437,Yuri Seijin Naoko-san (2012),"Comedy, Shoujo Ai"
12439,Soukou Kihei Votoms: Vol.1 Stories of the &#039;A.T. Votoms&#039;,"Action, Mecha, Military, Drama, Sci-Fi"
12441,Soukou Kihei Votoms: Vol.2 Highlights of the &#039;A.T. Votoms&#039;,"Action, Mecha, Military, Drama, Sci-Fi"
12445,Tasogare Otome x Amnesia,"Horror, Mystery, Romance, School, Shounen, Supernatural"
12447,Ben-To Picture Drama,Comedy
12449,Maken-Ki! Specials,"Ecchi, Sports"
12451,Gattai Robot Atranger,Mecha
12455,Yuu☆Yuu☆Hakusho: Mu Mu Hakusho,Comedy
12461,Hiiro no Kakera,"Fantasy, Romance, Shoujo, Supernatural"
12467,Nazo no Kanojo X,"Romance, School, Seinen"
12471,Eureka Seven AO,"Action, Adventure, Drama, Mecha, Sci-Fi"
12477,Sakasama no Patema,"Sci-Fi, Seinen"
12481,Gregory Horror Show: The Second Guest,"Mystery, Comedy, Horror, Demons, Supernatural, Vampire"
12483,Gregory Horror Show: The Last Train,"Mystery, Comedy, Horror, Demons, Supernatural, Vampire"
12485,Gregory Horror Show: The Bloody Karte,"Mystery, Comedy, Horror, Demons, Supernatural, Vampire"
12487,Kyoukaisenjou no Horizon II,"Action, Fantasy, Sci-Fi"
12497,Garakuta-doori no Stain: Epilogue,Comedy
12499,Crayon Shin-chan Movie 20: Arashi wo Yobu! Ora to Uchuu no Princess,"Comedy, Seinen"
12501,Ai Mai! Moe Can Change!,"Comedy, Sci-Fi"
12503,Mirai Nikki (TV): Ura Mirai Nikki,"Action, Comedy, Supernatural"
12505,C³ Special,"Action, Ecchi, Comedy, Supernatural, School"
12521,Tentoumushi no Otomurai,Music
12529,Time-Patrol Bon: Fujiko F. Fujio Anime Special - SF Adventure,"Action, Adventure"
12531,Sakamichi no Apollon,"Drama, Josei, Music, Romance, School"
12549,"Dakara Boku wa, H ga Dekinai.","Comedy, Ecchi, Romance, Supernatural"
12561,Benkei tai Ushiwaka,"Action, Comedy"
12565,Fate/Prototype,"Action, Supernatural, Magic, Romance, Fantasy, Shounen"
12569,Himitsu no Akko-chan (Movie),"Magic, School, Shoujo"
12579,Itsuka Tenma no Kuro Usagi Picture Drama,"Comedy, Ecchi, Romance, Shounen, Supernatural, Vampire"
12581,Asa made Jugyou Chu!,"Comedy, Ecchi, Romance, School"
12585,Inazuma Eleven Go: Tokubetsu-hen,"Sports, Super Power, Shounen"
12589,3 Choume no Tama: Onegai! Momo-chan wo Sagashite!!,"Adventure, Kids"
12591,Ojamajo Doremi OVA,"Kids, Magic"
12599,Ijime: Ikenie no Kyoushitsu,"Drama, Shoujo"
12603,Tora-chan to Hanayome,Drama
12611,Sengoku Collection,"Fantasy, Parody, Samurai"
12613,Morizo to Kikkoro,Kids
12623,Egomama,Music
12637,"Mogyutto ""Love"" de Sekkinchuu!",Music
12643,Happening Star ☆,"Comedy, Sci-Fi"
12651,Danball Senki W,"Action, Kids, Mecha"
12657,Tongari Boushi no Memole: Marielle no Housekibako,"Fantasy, Magic, Shoujo"
12659,Nisoku Hokou,Music
12661,Light Lag,Music
12663,Patalliro! Stardust Keikaku,"Adventure, Comedy, Romance, Shoujo, Shounen Ai"
12665,"Yuru Yuri: Doushite, Tomaranai, Tokimeki, Dokidoki, Paradox, Eternal",Comedy
12669,Amagami SS+ Plus Specials,Romance
12671,Pokemon Best Wishes! Season 2: Kyurem vs. Seikenshi,"Action, Adventure, Comedy, Kids, Drama, Fantasy"
12673,Papa no Iukoto wo Kikinasai!: Pokkapoka,"Comedy, Romance, Slice of Life"
12677,Ozma,"Action, Sci-Fi, Adventure"
12679,Joshiraku,"Slice of Life, Comedy, Shounen"
12683,Yumeyume,Music
12685,Code Geass: Hangyaku no Lelouch - Nunnally in Wonderland,"Comedy, Parody, Fantasy"
12689,Kiss Dum R: Meguriahi,"Mecha, Military, Sci-Fi"
12695,Tight-rope,"Romance, Shounen Ai"
12699,Tales of Gekijou,Comedy
12709,Tales of Symphonia The Animation: Sekai Tougou-hen Specials,Comedy
12711,Uta no☆Prince-sama♪ Maji Love 2000%,"Comedy, Harem, Music, Romance, School, Shoujo"
12715,The Hakkenden: Shin Shou,"Action, Adventure, Historical, Demons, Martial Arts, Samurai, Shounen"
12723,Loups=Garous Pilot,"Thriller, Mystery, Sci-Fi"
12725,Initial D: Project D to the Next Stage - Project D e Mukete,"Action, Cars, Sports, Drama, Seinen"
12727,Thermae Romae Specials,"Comedy, Historical, Seinen"
12729,High School DxD OVA,"Comedy, Demons, Ecchi, Romance, School"
12745,Bari Bari Densetsu (1987),"Action, Drama, Shounen, Sports"
12753,Phi Brain: Kami no Puzzle - Orpheus Order-hen,"Action, Game, Mystery, Shounen"
12755,Mahoutsukai Jiji,"Music, Magic, Fantasy"
12759,Zoku Zoku Mura no Obaketachi,Fantasy
12763,0-sen Hayato,"Historical, Military"
12765,Yuuyake Banchou,Action
12767,Yuusei Kamen,Sci-Fi
12769,Yumemakura Baku Twilight Gekijou,"Horror, Psychological"
12771,Youyou no Neko Tsumami,"Slice of Life, Comedy"
12781,Yoshimoto Muchikko Monogatari,Comedy
12783,Sora no Otoshimono Final: Eternal My Master,"Comedy, Ecchi, Harem, Sci-Fi, Shounen, Supernatural"
12789,Yasashii Lion,"Fantasy, Kids, Music"
12791,Yankee Reppuu-tai,"Adventure, Drama, Shounen"
12793,Yanbo Ninbo Tonbo,Fantasy
12795,Yajikita Gakuen Douchuuki,"Adventure, Martial Arts, School, Shoujo"
12799,Xevious,"Action, Adventure, Sci-Fi, Space"
12803,Chinkoroheibei Tamatebako,"Kids, Fantasy, Comedy"
12807,Wonder-kun no Hatsu Yume Uchuu Ryokou,Adventure
12809,Wonder Bebil-kun,"Comedy, Fantasy"
12815,Shirokuma Cafe,"Slice of Life, Comedy, Josei"
12823,Shakugan no Shana III (Final) Specials,"Comedy, Parody"
12833,Ushiro no Hyakutarou,"Horror, School, Supernatural"
12835,Umeboshi Denka,"Comedy, Slice of Life"
12851,Ultraman USA,"Action, Adventure, Sci-Fi"
12857,Star Driver the Movie,"Action, Mecha, Romance, Shounen"
12859,One Piece Film: Z,"Action, Adventure, Comedy, Drama, Fantasy, Shounen"
12861,Umeboshi Denka: Uchuu no Hate kara Panparopan!,Comedy
12863,Pretty Rhythm: Dear My Future,"Slice of Life, Sports, Music, Shoujo"
12865,Ai wa KAT-TUN,Comedy
12867,Tsuki no Sango,Drama
12875,Ginga e Kickoff!!,"Sports, Shounen"
12877,Bokurano Recap,"Drama, Mecha, Psychological, Sci-Fi"
12879,Dantalian no Shoka: Ibarahime,"Action, Historical, Mystery"
12881,Tsuki wa Higashi ni Hi wa Nishi ni: Operation Sanctuary OVA,"Comedy, Drama, Harem, Romance, Sci-Fi"
12883,Tsuritama,"Comedy, Sci-Fi, Slice of Life, Sports"
12885,Dynamic Super Robots Soushingekki,"Action, Mecha, Sci-Fi, Shounen"
12887,Uchuu Shounen Soran,"Action, Adventure, Sci-Fi"
12893,Danshi Koukousei no Nichijou Specials,"Comedy, School, Shounen, Slice of Life"
12895,Uchuu Shounen Soran (Movie),"Action, Adventure, Sci-Fi"
12897,Uchuu Patrol Hopper,"Sci-Fi, Space"
12899,Ucchare Goshogawara,"Martial Arts, School, Shounen, Sports"
12901,TWD Express Rolling Takeoff,"Adventure, Sci-Fi"
12903,Tsushima Maru: Sayounara Okinawa,Historical
12905,Tsuki ga Noboru made ni,"Drama, Historical"
12907,Sekiei Ayakashi Mangatan,"Fantasy, Historical, Supernatural"
12917,Madang-Eul Naon Amtalg,"Adventure, Drama, Fantasy, Kids"
12919,Yoru no Hi,Psychological
12921,Morita-san wa Mukuchi. Specials,"Comedy, School, Slice of Life"
12929,Saint Seiya Omega,"Action, Adventure, Fantasy, Shounen"
12935,Utakata Hanabi,Music
12951,AWOL,"Action, Space, Military, Sci-Fi"
12963,Jewelpet Kira☆Deco!,"Fantasy, Magic, Shoujo"
12965,Jewelpet Movie: Sweets Dance Princess,"Fantasy, Magic, Shoujo"
12967,Arcana Famiglia,"Action, Harem, Supernatural, Romance, Shoujo"
12971,Himitsu no Akko-chan: Umi da! Obake da!! Natsu Matsuri,"Magic, Shoujo"
12979,Naruto SD: Rock Lee no Seishun Full-Power Ninden,"Action, Comedy, Parody"
12981,Kono Shihai kara no Sotsugyou: Ozaki Yutaka,"Historical, Slice of Life"
12991,Katte ni Kaizou Specials,"Comedy, Parody, School, Sci-Fi, Shounen"
12993,Sono Mukou no Mukougawa,Music
13029,Arashi no Yoru ni: Himitsu no Tomodachi,"Adventure, Drama"
13041,Battle Break,"Action, Kids"
13047,Anime Koukyoushi: Jungle Taitei,"Adventure, Kids, Shounen"
13053,Aimai Elegy,Music
13055,Sankarea OVA,"Comedy, Ecchi, Horror, Romance, Shounen, Supernatural"
13073,Tennis no Ouji-sama: Another Story II - Ano Toki no Bokura Specials,"Sports, Shounen"
13083,Fushigi na Kusuri,"Slice of Life, Comedy"
13085,Kitsutsuki Keikaku,"Slice of Life, Comedy"
13087,Youkoso Uchuujin,Comedy
13089,Hana to Mogura,Comedy
13091,Ojiichan ga Kaizoku Datta Koro,Comedy
13093,Nazo no Kanojo X: Nazo no Natsu Matsuri,"Ecchi, Romance, Mystery, Seinen"
13103,Ponta to Ensoku,"Adventure, Drama"
13115,Hakuouki Reimeiroku,"Action, Historical, Supernatural, Drama, Samurai, Josei"
13117,Hakuouki Movie 1: Kyoto Ranbu,"Action, Historical, Supernatural, Drama, Samurai, Josei"
13119,Hakuouki Movie 2: Shikon Soukyuu,"Action, Historical, Supernatural, Drama, Samurai, Josei"
13125,Shinsekai yori,"Sci-Fi, Mystery, Horror, Psychological, Supernatural, Drama"
13137,Itsuka Tenma no Kuro Usagi Special,"Comedy, Ecchi"
13139,Gakkatsu!,"Comedy, School"
13141,Shibainuko-san,Comedy
13143,Baku Tech! Bakugan,"Action, Game, Shounen"
13145,Cardfight!! Vanguard: Asia Circuit-hen,"Action, Game, Adventure, Demons, Shounen"
13153,Renkyori Enai,Music
13159,Kuromajo-san ga Tooru!!,"Comedy, Magic, School, Slice of Life"
13161,Hagure Yuusha no Aesthetica,"Action, Super Power, Ecchi, Fantasy"
13163,Furusato Saisei: Nippon no Mukashibanashi,"Historical, Kids, Supernatural"
13165,Paboo & Mojies,Kids
13167,Zoobles!,Kids
13169,Buta,"Adventure, Comedy, Fantasy, Historical"
13171,Wasurenagumo,"Comedy, Supernatural"
13173,Puka Puka Juju,"Fantasy, Slice of Life"
13175,Shiranpuri (Movie),"School, Drama"
13177,Little Charo,Slice of Life
13179,Little Charo 2,Slice of Life
13183,Fate/Zero Remix,"Action, Fantasy, Supernatural"
13185,Juusen Battle Monsuno,"Action, Adventure"
13195,"Misenai Namida wa, Kitto Itsuka","Fantasy, Music"
13201,Monster Farm: Legend e no Michi,"Action, Adventure, Comedy, Fantasy"
13203,Lupin the Third: Mine Fujiko to Iu Onna,"Action, Adventure, Comedy, Ecchi, Samurai, Seinen"
13207,Himitsukessha Taka no Tsume Gaiden: Mukashi no Yoshida-kun,"Comedy, Historical, Parody"
13215,Guskou Budori no Denki (2012),"Slice of Life, Kids, Drama, Fantasy"
13231,Metal Fight Beyblade Zero G,"Adventure, Sports"
13233,Mugen no Ryvius: Illusion,Comedy
13239,Mass Effect: Paragon Lost,"Action, Adventure, Sci-Fi"
13245,Shin Tennis no Ouji-sama Specials,"Action, Comedy, Sports, Shounen"
13247,Lupin III: Lupin Ikka Seizoroi,"Adventure, Comedy, Seinen"
13249,Lupin VIII,"Adventure, Comedy, Shounen"
13251,Shin Hikari Shinwa: Palutena no Kagami,"Adventure, Fantasy, Comedy"
13253,Blossom,Music
13255,Haru wa Kuru,Adventure
13259,Kyoto Animation: Ajisai-hen,Magic
13261,Inazuma Eleven Go: Chrono Stone,"Sports, Super Power, Shounen"
13263,Fate/Zero: Onegai! Einzbern Soudanshitsu,Comedy
13267,Shinryaku!! Ika Musume,"Slice of Life, Comedy, Shounen"
13271,Hunter x Hunter Movie 1: Phantom Rouge,"Action, Adventure, Super Power, Shounen"
13281,FlashBack,Music
13283,One Off,Slice of Life
13287,Galaxy Angel Specials,"Comedy, Sci-Fi"
13299,Houkago no Tinker Bell,"Comedy, Drama, Mystery, Romance, School, Slice of Life"
13303,Usogui,"Game, Psychological, Seinen"
13307,Shounen Ninja Kaze no Fujimaru,"Action, Adventure, Samurai, Shounen"
13309,Kyoto Animation: Hoshi-hen,Fantasy
13311,Henshin Gattai! 5 tsu no Atsuki Tamashii,"Super Power, Music"
13331,Jormungand: Perfect Order,"Action, Adventure, Seinen"
13333,Tari Tari,"Music, Slice of Life, School"
13335,Fuse: Teppou Musume no Torimonochou,"Action, Drama, Historical, Supernatural"
13349,Chouyaku Hyakuninisshu: Uta Koi.,"Historical, Josei, Romance"
13357,High School DxD Specials,"Ecchi, Comedy, Harem, Romance, Demons, School"
13359,PistStar,Magic
13365,Samchongsa: Time Machine 001,"Adventure, Sci-Fi"
13367,"Kono Naka ni Hitori, Imouto ga Iru!","Harem, Mystery, Comedy, Romance, Ecchi, School"
13369,Cornelis,Comedy
13373,Kyoto Animation: Hana-hen,Slice of Life
13375,Kyoto Animation: Sora-hen,Slice of Life
13377,Recorder to Randoseru Re♪,"Slice of Life, Comedy, School, Seinen"
13391,Rakuen Tsuihou,"Action, Sci-Fi, Mecha"
13403,Inu x Boku SS Special,"Comedy, Supernatural, Shounen"
13405,Utsu Musume Sayuri,"Comedy, Dementia"
13407,Doudou,Fantasy
13409,Moyashimon Returns,"Comedy, School, Supernatural"
13411,Guilty Crown: Lost Christmas,"Action, Drama, Sci-Fi, Super Power"
13421,Wheels,Comedy
13423,Fushigi Sekai Atagoul Monogatari,Adventure
13427,PES: Peace Eco Smile,"Slice of Life, Space"
13429,Sakasama no Patema: Beginning of the Day,Sci-Fi
13431,Himitsukessha Taka no Tsume NEO,"Comedy, Parody, Super Power"
13433,himitsukesshatakanotsume.jp,"Comedy, Parody, Super Power"
13435,Taka no Tsume NEO Announcement Movie,"Comedy, Parody, Super Power"
13439,Shinpi no Hou,"Adventure, Supernatural"
13441,Shiawasette Naani,Fantasy
13449,Shippuu! Iron Leaguer: Silver no Hata no Moto ni,"Sports, Mecha"
13455,Zumomo to Nupepe,Comedy
13457,Tomodachi 8-nin,"Comedy, Kids"
13459,Ribbon-chan,Comedy
13463,Panda no Taputapu,Kids
13465,Little Charo: Touhoku-hen,Kids
13469,Hyouka: Motsubeki Mono wa,"Slice of Life, Mystery, School"
13479,Uchuu Kyoudai: Apo&#039;s Dream,"Comedy, Sci-Fi, Space"
13495,Tokyo Disney Resort: Yume ga Kanau Basho,Slice of Life
13497,Neko no Sumu Shima,Drama
13499,Himitsukessha Taka no Tsume THE PLANETARIUM: Burabura! Black Hole no Nazo,"Adventure, Comedy, Parody, Space"
13501,Cofun Gal no Coffy,"Comedy, Historical, Parody"
13503,Cofun Gal no Coffy (TV),"Comedy, Parody"
13505,Cofun Gal no Coffy Campus Life,Comedy
13507,Cofun Gal no Coffy: Okehazama no Tatakai,"Parody, Comedy, Historical"
13509,Cofun Gal no Coffy: Juuninin to Ikareru Kofun-tachi,Comedy
13511,Cofun Gal no Coffy: Cofunderella,Comedy
13513,Anima,Music
13515,Neo Satomi Hakkenden: Satomi-chanchi no Hachi Danshi,Comedy
13517,Ryuugajou Nanana no Maizoukin,"Comedy, Supernatural"
13519,Organic,Comedy
13535,Binbougami ga!,"Comedy, Parody, Shounen, Supernatural"
13541,Rui no Masaiban,Comedy
13543,Nantokashite Alguard,Comedy
13551,Shuukan Storyland,"Slice of Life, Comedy, Drama, Seinen"
13553,Bakusou Circuit Roman Twin,Sports
13561,Guilty Crown: 4-koma Gekijou,Comedy
13563,The Four Seasons,Slice of Life
13585,Natsuyuki Rendezvous,"Supernatural, Drama, Romance, Josei"
13587,Persona 4 the Animation: No One is Alone,"Sci-Fi, Adventure, Mystery, Super Power, Supernatural, School"
13599,Robotics;Notes,"Sci-Fi, Mystery, Drama, Mecha, School"
13601,Psycho-Pass,"Action, Police, Psychological, Sci-Fi"
13619,Sayonara Zetsubou Sensei Special Omake,"Comedy, Parody, School"
13629,Furiko,"Music, Slice of Life, Drama, Romance"
13639,Hi no Youjin,"Historical, Slice of Life"
13655,Little Busters!,"Slice of Life, Comedy, Supernatural, Drama, School"
13659,Ore no Imouto ga Konnani Kawaii Wake ga Nai.,"Slice of Life, Comedy, Romance"
13663,To LOVE-Ru Darkness,"Comedy, Ecchi, Harem, Romance, School, Sci-Fi, Shounen"
13667,Naruto: Shippuuden Movie 6 - Road to Ninja,"Action, Super Power, Adventure, Martial Arts, Shounen"
13669,Owari no Chronicle,"Action, Adventure, Fantasy, Sci-Fi"
13673,Otome Nadeshiko Koi Techou,"Historical, Shoujo"
13675,Taisei Kensetsu: Bosporus Kaikyou Tunnel,Drama
13677,Ao no Exorcist Movie Special,"Parody, Comedy"
13679,Tottoko Hamtarou Hai!,"Kids, Adventure"
13681,Nekogami Yaoyorozu Specials,"Comedy, Supernatural, Seinen"
13691,Taisei Kensetsu: Shin Doha Kokusai Kuukou,Drama
13693,Ippatsu Hicchuu!! Devander,"Action, Sci-Fi, Parody, Super Power, Mecha"
13709,Afro Samurai Movie,"Action, Adventure, Samurai"
13715,Kennel Tokorozawa,"Ecchi, Comedy, School"
13727,Rinne no Lagrange: Kamogawa Days,"Slice of Life, Comedy, School, Sci-Fi"
13731,Eureka Seven: New Order,"Adventure, Drama, Mecha, Romance, Sci-Fi"
13755,Shanshui Qing,Music
13757,Mashiro-iro Symphony: The Color of Lovers Picture Drama,"Harem, Romance, Drama"
13759,Sakurasou no Pet na Kanojo,"Comedy, Drama, Romance, School, Slice of Life"
13767,Junjou Romantica OVA,"Comedy, Drama, Romance, Shounen Ai"
13769,Kamen no Ninja Akakage,"Action, Fantasy"
13781,Dokkiri Doctor Special,"Comedy, Ecchi"
13789,Little Nemo Pilot,Adventure
13793,Fashion no Hajimari,Comedy
13795,The Green Wind,Fantasy
