animeid,title,genres
30133,"Ima, Futari no Michi",Drama
30134,Hong Gil Dong 2084,"Action, Adventure"
30135,Topo Gigio no Botan Sensou,"Kids, Historical"
30137,Big Order,"Action, Super Power, Shounen"
30138,Rusuden Hour: Sodan Brothers,Comedy
30139,Manga Doushite Monogatari OVA,"Kids, Adventure, Comedy"
30140,Xing Mao Lixian Ji Zhi Shu Fa Pian,"Kids, Adventure"
30143,Bobobo-bo Bo-bobo Recap,"Action, Parody, Comedy, Sci-Fi, Shounen"
30144,Nyuru Nyuru!! Kakusen-kun 2nd Season,Comedy
30145,Harukanaru Toki no Naka de: Hachiyou Shou Recap,"Fantasy, Magic, Supernatural, Demons, Historical, Shoujo"
30148,Kamiusagi Rope Specials,"Comedy, Slice of Life"
30149,Kamiusagi Rope 2 Specials,"Comedy, Slice of Life"
30150,Kamiusagi Rope 3,"Comedy, Slice of Life"
30151,Kamiusagi Rope: Warau Asa ni wa Fukuraitaru tte Maji ssuka!?,"Slice of Life, Comedy"
30152,au x Rope,"Slice of Life, Comedy"
30153,Takarakuji x Rope,"Comedy, Slice of Life"
30154,Kamiusagi Rope (ONA),"Slice of Life, Comedy"
30155,Hoshi no Kirby:  Taose!! Koukaku Majuu Ebizou,"Action, Adventure, Comedy, Fantasy"
30156,Ba La La Xiao Mo Xian Zhi: Meng Huan Xuan Lu,"Comedy, Magic, Shoujo"
30157,Joki Joki Tailor,"Music, Kids"
30158,Okore!! Nonkuro,Kids
30159,Super Taromu,"Mecha, Shounen"
30160,Oppai ga Ippai,"Music, Kids"
30161,Horoscope: Anata no Seiza,"Music, Kids"
30162,Hone Hone Rock,"Music, Kids"
30163,Fuki to Hiyoko,"Music, Kids"
30164,Chiisana Kinomi (1995),"Music, Kids"
30165,Yamaguchi Sanchi no Tsutomu-kun,"Music, Kids, Romance"
30166,Wangpai Yushi Di 0 Ji,"Comedy, Fantasy, School, Shounen, Supernatural"
30167,Kanashiki Mongoose,"Music, Kids"
30168,Miss Monochrome: Watashi dake no Monogatari,Music
30169,Yubikiri,Music
30173,Fruity Samurai,"Action, Comedy, Samurai, Historical"
30176,Kujira,Adventure
30177,Ninja Hattori-kun (2012) Special,"Kids, Comedy"
30178,Tiger & Bunny Recaps,"Action, Comedy, Super Power, Mystery"
30187,Sakurako-san no Ashimoto ni wa Shitai ga Umatteiru,Mystery
30191,Durarara!!x2 Shou: Watashi no Kokoro wa Nabe Moyou,"Action, Mystery, Supernatural"
30193,Eun-sil-i,Drama
30196,Tsubasa to Hotaru (2015),"Romance, School, Shoujo"
30198,Manga Naruhodo Monogatari OVA,"Kids, Adventure"
30199,Hakimono to Kasa no Monogatari,"Music, Kids"
30200,Piyo no Ongaeshi,Music
30201,Shiawase no Tokei,Music
30202,Bucket no Ana,Music
30204,Ryoukan-san,Historical
30205,Aoharu x Kikanjuu,"Action, Comedy, Sports, Shounen"
30206,Amagi Brilliant Park: Nonbirishiteiru Hima ga Nai!,"Comedy, Magic, Fantasy"
30207,Watashi wa Tofu Desu,"Kids, Music"
30208,Shiritori Mambo,"Kids, Music"
30209,Naze,"Kids, Music"
30210,Souiu Megane,Dementia
30211,Zenchuu Maite,Dementia
30212,Kono Mayonnaise wa Yuru Sugiru,Dementia
30213,Yume Utsutsu,Dementia
30214,A Smart Experiment,Dementia
30217,Neo Faust,Supernatural
30218,The iDOLM@STER Cinderella Girls: Special Program,"Comedy, Music"
30228,Chel-in sacheon-wang,"Action, Sci-Fi"
30230,Diamond no Ace: Second Season,"Comedy, Sports, School, Shounen"
30232,Tamagotchi! Tamatomo Daishuu GO,"Comedy, Fantasy, Kids"
30234,1989,"Space, Music"
30235,Kochira Tamago Outou Negaimasu,"Comedy, School"
30237,Hyakka Ryouran: Samurai After Specials,Ecchi
30240,Prison School,"Comedy, Ecchi, Romance, School, Seinen"
30241,Umo,Music
30245,"Kamaishi no ""Kiseki"": Inochi wo Mamoru Tokubetsu Jugyou",Drama
30246,Space☆Dandy 2nd Season Picture Drama,"Comedy, Sci-Fi, Space"
30247,Congming de Yixiu Zhi Fan Dou Gongzhu,"Kids, Comedy, Historical"
30249,Balgwanghaneun Hyeondaesa,Drama
30250,Triage X: Recollection XOXO,"Action, Ecchi, School, Shounen"
30251,Venus Project: Climax,"Action, Music"
30263,Hello Kitty no Shirayuki-hime (OVA),"Kids, Fantasy"
30264,Hello Kitty no Cinderella (OVA),"Kids, Fantasy"
30267,Chan Shuo A Kuan,"Slice of Life, Comedy"
30268,Huang Feihong Yong Chuang Tianxia,"Action, Martial Arts, Shounen"
30276,One Punch Man,"Action, Sci-Fi, Comedy, Parody, Super Power, Supernatural, Seinen"
30278,Ghost Messenger Movie,"Action, Fantasy"
30279,Yuru Yuri San☆Hai!,"Comedy, School, Shoujo Ai, Slice of Life"
30284,Taabou no Ganbaru Sengen,Kids
30289,Dededen,Slice of Life
30290,Fw:Hamatora,"Mystery, Comedy, Super Power"
30291,Mini Hama: Minimum Hamatora,"Comedy, Mystery, School, Shounen, Super Power"
30292,Saki Achiga-hen: Episode of Side-A - Kuro no Tanjoubi,"Game, School, Slice of Life"
30296,Rakudai Kishi no Cavalry,"Action, Romance, Ecchi, Fantasy, School"
30298,Mahou no Princess Minky Momo: Yume wo Dakishimete Specials,"Magic, Shoujo"
30300,"High School DxD New: Oppai, Tsutsumimasu!","Comedy, Demons, Ecchi, Romance, School"
30305,Norakuro Compilation OVA,Comedy
30307,Monster Musume no Iru Nichijou,"Harem, Comedy, Romance, Ecchi, Fantasy, Seinen"
30309,Yuuyake Dandan,Slice of Life
30311,Kuroko no Basket 3rd Season NG-shuu,"Comedy, Sports"
30312,Manga Hajimete Omoshiro Juku OVA,"Kids, Adventure"
30313,Kaiketsu Zorori Movie: Uchuu no Yuusha-tachi,"Adventure, Comedy"
30321,Strike the Blood: Valkyria no Oukoku-hen,"Action, Supernatural, Ecchi, Vampire, Fantasy, School, Shounen"
30324,Obake no Dokurou,"Kids, Supernatural"
30326,Ushi Atama,Dementia
30327,New York Trip,Dementia
30328,Head Spoon,Dementia
30329,Nice to See You,Dementia
30330,Utsukushii Hoshi,Dementia
30331,Motion Lumine,Dementia
30332,Comics,Dementia
30334,Sleepy,Dementia
30335,Portrait,Dementia
30336,Tori,Dementia
30337,Mac the Movie,Dementia
30339,Play Jazz,Dementia
30340,Direct Animation,Dementia
30341,Tarzan,Dementia
30342,Funassyi no Funafunafuna Biyori,"Comedy, Kids, Slice of Life"
30343,Legend of the Moles: The Frozen Horror,"Kids, Adventure, Fantasy"
30344,The iDOLM@STER Cinderella Girls 2nd Season,"Comedy, Drama, Music"
30346,Doukyuusei (Movie),"Slice of Life, Romance, School, Shounen Ai"
30347,Nanatsu no Taizai OVA,"Action, Adventure, Supernatural, Magic, Fantasy, Shounen"
30349,Legend of the Moles: The Treasure of Scylla,"Kids, Adventure, Fantasy"
30355,Wakaba*Girl,"Comedy, School, Slice of Life"
30358,Turnover,"Slice of Life, School"
30360,Poppen-sensei to Kaerazu no Numa,"Adventure, Fantasy, Kids"
30362,Garon,Sci-Fi
30363,Shinmai Maou no Testament Burst,"Action, Harem, Demons, Romance, Ecchi, Fantasy"
30364,Haikyuu!! Movie 2: Shousha to Haisha,"Comedy, Sports, Drama, School, Shounen"
30365,Shinmai Maou no Testament Burst OVA,"Action, Harem, Demons, Romance, Ecchi, Fantasy"
30367,Lemon Home Animation Gekijou,Comedy
30370,Akatsuki no Yona OVA,"Action, Comedy, Fantasy, Shoujo"
30375,Starmyu,"Music, School, Slice of Life"
30376,Isshuukan Friends.: Tomodachi to no Omoide,"Comedy, School, Slice of Life"
30378,Sanzoku Diary,"Slice of Life, Seinen"
30379,Nagato Yuki-chan no Shoushitsu: Owarenai Natsuyasumi,"Slice of Life, Comedy, Seinen"
30381,Sousei no Aquarion Evol,"Mecha, Romance, Sci-Fi"
30382,Aquarion Logos,"Action, Comedy, Drama, Fantasy, Mecha, Romance, Sci-Fi"
30383,Classroom☆Crisis,"School, Sci-Fi"
30384,Miss Monochrome: The Animation 2,"Comedy, Music, Slice of Life"
30385,Valkyrie Drive: Mermaid,"Action, Ecchi, Fantasy, Shoujo Ai"
30386,Pikaia!,"Drama, Kids, Slice of Life"
30390,Sengoku Musou: Sengoku Musou High School,"Comedy, Samurai, School"
30392,Joukyou Monogatari,Slice of Life
30393,Hana no Hanashi,Slice of Life
30394,Teddy,Slice of Life
30395,Kuripuri*Kuripura,Comedy
30396,Akai Kutsu! Onnanoko!,Dementia
30397,Mori no Kuma-san,Slice of Life
30398,Nani ga Dekiru ka na,Comedy
30400,Yakusoku,Dementia
30401,Rule,Dementia
30403,Paper Film,Comedy
30404,Taku Boda,Dementia
30405,Ishindenshin Shiyou,"Kids, Music"
30407,Kitsutsuki: The Ten Hole Stories,Dementia
30409,Nepos Napos,"Kids, Fantasy"
30410,Gon 2nd Season,"Action, Adventure, Kids"
30411,Happy Jozy,Comedy
30412,Shi Xiong,"Action, Comedy, Horror"
30413,Yowamushi Pedal Movie,"Comedy, Drama, Shounen, Sports"
30415,High☆Speed!: Free! Starting Days,"School, Slice of Life, Sports"
30417,Panpaka Pants O-New!,"Comedy, Kids"
30418,Petit Manga,Dementia
30419,"Wake Up, Girls! Beyond the Bottom","Music, Drama"
30420,Dr. Slump: Arale-chan no Koutsuu Anzen,"Sci-Fi, Comedy, Shounen"
30424,Instant Music,Music
30425,Wake Up! Dodo,Music
30427,Mr. Empty,Music
30428,Hikenai Guitar wo Hikundaze,Music
30429,Utsukushii,Music
30430,Kimi wa Sou Kimeta,Music
30431,Anata mo Robot ni Nareru feat. Kamome Jidou Gasshoudan,Music
30433,Eat You Up/Bunny,Music
30437,Wakako-zake,"Seinen, Slice of Life"
30438,MILPOM★ Pilot,"Comedy, Shoujo"
30442,Kana Kana Kazoku x Himitsukessha Taka no Tsume Collaboration Film,Comedy
30443,Kana Kana Kazoku: Shinnen no Goaisatsu,Comedy
30444,Kana Kana Kazoku: Stop Rubella,Comedy
30445,"Wake Up, Girls! Deai no Kiroku: A Brief Recording",Music
30446,Akazukin to Kenkou,Comedy
30447,Shika to Kanta,"Adventure, Kids"
30449,Dr. Slump: Robot Taiketsu! Shukuteki Dr. Mashirito Toujou / Keen de Yuushou!? Penguin Grand Prix,"Comedy, Mecha, Sci-Fi, Shounen"
30450,Dr. Slump: Hoyoyo! Arale no Himitsu Dai Koukai dayo!!,"Comedy, Sci-Fi, Shounen"
30453,Dr. Slump: Arale-chan Ayaya!? Penguin Mura de TV Jack,"Comedy, Sci-Fi, Shounen"
30457,Kachikachi Yama no Shouboutai,Comedy
30458,"Tokyo Ghoul: ""Jack""","Action, Drama, Horror, School, Seinen, Supernatural"
30463,Kyoufu Shinbun (2014),"Horror, Demons, Supernatural, Fantasy"
30464,Shinmai Maou no Testament Specials,"Comedy, Demons, Ecchi, Fantasy"
30468,My Melody no Akazukin (OVA),"Kids, Fantasy"
30470,Himitsukessha Taka no Tsume DO,"Comedy, Parody, Super Power"
30473,"Nemure Omoigo, Sora no Shitone ni","Adventure, Space, Drama"
30480,Bara Bara Film,Dementia
30481,Ginga Tetsudou 999 for Planetarium,"Adventure, Space, Drama, Sci-Fi"
30483,Ginga Tetsudou 999: Akai Hoshi Betelgeuze - Inochi no Kagayaki,"Adventure, Space, Drama, Sci-Fi"
30484,Steins;Gate 0,"Sci-Fi, Thriller"
30485,ChäoS;Child,"Psychological, Harem, Supernatural, Mystery, Sci-Fi"
30489,Minna Atsumare! Falcom Gakuen SC Special,"Parody, Comedy, School, Seinen"
30499,Rolling☆Girls: Chibi☆Rolling☆Girls Korokoro Gekijou,Slice of Life
30503,Noragami Aragoto,"Action, Adventure, Comedy, Supernatural, Shounen"
30512,Hero Company,"Comedy, Super Power, Seinen"
30514,Nisekoimonogatari,Music
30519,Ba La La Xiao Mo Xian Zhi: Caihong Xin Shi,"Comedy, Magic, Shoujo"
30524,Kagewani,"Horror, Mystery, Supernatural, Thriller"
30530,Fuusen Shoujo Temple-chan Movie,"Adventure, Comedy, Kids, Music"
30531,Gakuen Handsome The Animation,"Comedy, Parody, School, Shounen Ai"
30533,Gundam Build Fighters Try: Island Wars,"Action, Sci-Fi, Mecha"
30534,Fen Qing,Music
30537,Tiger & Bunny: Too Many Cooks Spoil the Broth.,"Action, Comedy, Mystery, Super Power"
30544,Gakusen Toshi Asterisk,"Action, Comedy, Ecchi, Fantasy, Harem, Romance, School, Sci-Fi, Supernatural"
30547,Touhou Niji Sousaku Doujin Anime: Musou Kakyou Special,"Magic, Fantasy"
30549,Soukyuu no Fafner: Dead Aggressor - Exodus 2nd Season,"Action, Drama, Mecha, Military, Sci-Fi"
30556,Funassyi to Yukaina Kyoudai,"Comedy, Kids"
30559,Why,Dementia
30567,Teekyuu 5,"Comedy, Shounen, Sports"
30571,Chouon Senshi Borgman: Madnight☆Gigs!,"Action, Demons, Music, Sci-Fi, Shounen"
30573,Break Blade: Virgins War,Action
30576,Pareo wa Emerald,Music
30582,"That&#039;s Hanakappa Musical: Pan to Gohan, Docchi nano!?","Kids, Comedy, Music"
30585,Taifuu no Noruda,"Drama, School, Sci-Fi, Supernatural"
30600,Military! Special,"Military, Comedy, Ecchi"
30602,Great Hunt,"Comedy, Music"
30605,Uwabaki Cook no Tekitou Uranai!,Comedy
30617,Animegatari,Comedy
30625,Princess Princess Specials,"Comedy, School, Shoujo"
30634,Chikyuu wo Mitsumete,"Space, Sci-Fi"
30641,Yankee-kun na Yamada-kun to Megane-chan to Majo,"Comedy, School, Shounen"
30646,Perman (1983) Specials,"Comedy, Kids"
30647,Nemuranu Machi no Cinderella: Hirose Ryouichi - Memorial Date,Romance
30648,Stitch!: Zutto Saikou no Tomodachi Special,"Adventure, Comedy, Kids"
30649,Shin Atashin&#039;chi,"Slice of Life, Comedy"
30651,Itoshi no Muco,"Slice of Life, Comedy"
30652,Long Riders!,"Slice of Life, Comedy, Sports, Shounen"
30654,Ansatsu Kyoushitsu 2nd Season,"Action, Comedy, School, Shounen"
30659,Nouryou Anime: Denkyuu Ika Matsuri,"Psychological, Dementia, Horror"
30663,Docchi mo Maid,"Action, Comedy, Magic, Ecchi, Shoujo Ai"
30664,Jinkou no Rakuen,Dementia
30665,4.Eyes,Dementia
30666,Memories: Younenki no Joukei,Dementia
30667,Mou Hitotsu no Nijiiro Toshi,Dementia
30668,Walking Man,Dementia
30669,Why Re-Mix 2002,Dementia
30673,Made in Japan,Comedy
30679,Queen&#039;s Blade: Grimoire,"Action, Adventure, Ecchi, Fantasy"
30686,Pokemon XY: Hoopa no Odemashi Daisakusen!!,"Comedy, Fantasy, Kids"
30694,Dragon Ball Super,"Action, Adventure, Comedy, Fantasy, Martial Arts, Shounen, Super Power"
30695,Pop in Q,"Music, Fantasy"
30704,Kakko Kawaii Sengen! Specials,Comedy
30705,Makura no Danshi,Slice of Life
30709,Kamisama Hajimemashita: Kako-hen,"Comedy, Demons, Supernatural, Romance, Fantasy, Shoujo"
30711,Code Geass: Boukoku no Akito 5 - Itoshiki Monotachi e,"Action, Mecha, Military"
30714,Owari no Seraph: Owaranai Seraph,"Comedy, Police, Supernatural, Vampire, Shounen"
30721,Hacka Doll The Animation,"Comedy, Sci-Fi"
30723,Midori no Makibao Compilation OVA,"Sports, Comedy"
30727,Saenai Heroine no Sodatekata ♭,"Comedy, Ecchi, Harem, Romance, School"
30732,Agukaru: Play with Ibaraki-hen Episode 0,"Magic, Slice of Life, Supernatural"
30736,Shingeki no Bahamut: Virgin Soul,"Action, Adventure, Demons, Supernatural, Magic, Fantasy"
30738,Gamba: Gamba to Nakama-tachi,"Adventure, Kids"
30739,Ane Log: Moyako Neesan no Honpen wo Tobidashite Tomaranai Monologue Specials,"Comedy, Ecchi"
30740,Young Black Jack,"Historical, Drama, Seinen"
30743,Kanadian Families: Episode Zero,"Slice of Life, Comedy"
30745,Kyoukai no Kanata Movie: I&#039;ll Be Here - Kako-hen - Yakusoku no Kizuna,Music
30746,Fushigi na Somera-chan,"Comedy, Magic, Slice of Life"
30749,Saijaku Muhai no Bahamut,"Action, Harem, Supernatural, Romance, Ecchi, Fantasy, Mecha, School"
30751,Usavich Zero,Comedy
30752,himitsukesshatakanotsume.jp Specials,"Comedy, Parody"
30753,Himitsukessha Taka no Tsume The Movie 4: Kaspersky wo Motsu Otoko,"Parody, Comedy"
30754,Tamagotchi! x Taka no Tsume: Tamagotchi de Seikai Seifuku,"Comedy, Parody"
30757,Monster Strike,"Action, Fantasy, Game"
30759,Minna de Tonda,"Drama, Kids"
30760,Momoiro no Crayon,"Kids, Drama"
30761,Jin Ken Mamoru-kun to Ayumi-chan Sekai wo Shiawase ni,"Fantasy, Kids"
30762,Soumubu Sououka Yamaguchi Roppeita: Saibanin Project Hajimemasu!,Slice of Life
30763,Yuuki no Omamori,"Drama, Kids"
30764,Jibun no Mune ni te wo Atete,"Drama, Kids"
30765,Present,"Drama, Kids"
30766,Homé-Pato the Movie,Cars
30767,Wonder 3 Pilot,"Action, Adventure, Comedy, Sci-Fi"
30771,Mudai,"Slice of Life, Romance, Music, Drama"
30777,Kaijuu Sakaba Kanpai!,"Comedy, Supernatural"
30778,Fairy Tail Movie 2: Dragon Cry,"Action, Adventure, Comedy, Magic, Fantasy, Shounen"
30781,Matsubara-kun,Comedy
30782,Bikini Warriors,"Comedy, Ecchi, Fantasy, Parody"
30790,Yowamushi Pedal: Re:ROAD,"Drama, Shounen, Sports"
30795,Bakuon!!,"Comedy, Seinen, Slice of Life"
30796,Gokudou Sakaba Denden: Gokudou Daisensou Gaiden,Comedy
30803,"Planetarium Chibi Maruko-chan, Hoshi ni Negai wo","Kids, Slice of Life, Comedy, School"
30806,Schwarzesmarken,"Action, Military, Sci-Fi, Historical, Drama, Mecha"
30813,Youkoso Jitsuryoku Shijou Shugi no Kyoushitsu e,"Comedy, Romance, School"
30814,Landscape,Dementia
30818,City Hunter: Ryou no Propose,"Action, Mystery, Comedy, Police"
30825,Gakkou no Kaidan: Kubinashi Rider!! Shi no Noroi,"Horror, Mystery, Supernatural"
30826,Suzakinishi The Animation,"Slice of Life, Comedy"
30829,Love Live! School Idol Project 2nd Season Recap,"Music, School, Slice of Life"
30831,Kono Subarashii Sekai ni Shukufuku wo!,"Adventure, Comedy, Parody, Supernatural, Magic, Fantasy"
30839,Big X Episode 0,"Action, Historical, Sci-Fi, Shounen"
30840,Many Things SD Gundam,"Parody, Comedy, Mecha"
30842,Nekota no Koto ga Kininatte Shikatanai. (ONA),"School, Shoujo"
30845,Aikatsu! Music Award: Minna de Shou wo MoracchaimaShow!,"Music, Shoujo"
30850,UFO Gakuen no Himitsu,"Sci-Fi, Space"
30851,Q Transformers: Saranaru Ninki Mono e no Michi,"Slice of Life, Parody, Mecha"
30859,Memory of Red,Dementia
30860,Koumon-teki Juuku Ketsujiru Juke,"Music, Comedy, Dementia"
30863,Usalullaby,Dementia
30864,New Tokyo Ondo,Dementia
30865,Umi ni Ochita Tsuki no Hanashi,Kids
30868,Ajin Part 1: Shoudou,"Action, Horror, Mystery, Seinen, Supernatural"
30869,Ajin Part 2: Shoutotsu,"Action, Horror, Mystery, Seinen, Supernatural"
30870,Ajin Part 3: Shougeki,"Action, Horror, Mystery, Seinen, Supernatural"
30873,Madou King Granzort: Nonstop Rabi,"Action, Fantasy, Magic, Comedy, Mecha, Sci-Fi, Shounen"
30875,Washimo 3rd Season,"Comedy, Kids, School, Sci-Fi, Slice of Life"
30885,Noragami Aragoto OVA,"Action, Adventure, Comedy, Supernatural, Shounen"
30886,Mu Di,Music
30892,Boo Boo Boy,"Cars, Kids"
30893,Deban Desu Yo! Onigirizu,Comedy
30895,HaruChika: Haruta to Chika wa Seishun suru,"Music, Slice of Life, Mystery, Romance, School"
30896,Love Live! School Idol Project: μ&#039;s →NEXT LoveLive! 2014 - Endless Parade Encore Animation,Comedy
30901,Utawarerumono: Itsuwari no Kamen,"Action, Drama, Fantasy"
30902,Yuru Yuri Nachuyachumi!+,"Slice of Life, Comedy, Shoujo Ai"
30903,Children Record,Music
30905,Owanko,Comedy
30906,Malta no Bouken,"Kids, Slice of Life"
30907,Eine Kleine,"Music, Slice of Life, Drama, Romance"
30909,vivi,"Adventure, Music, Romance, Fantasy"
30911,Tales of Zestiria the X,"Action, Adventure, Magic, Fantasy"
30912,Robot Girls Z Episode 0,"Comedy, Mecha, Parody"
30913,Mekakucity Days,"Music, Psychological, Sci-Fi"
30914,Animax Taisou,"Sports, Kids"
30915,Kekkai Sensen: Soresaemo Saitei de Saikou na Hibi,"Action, Fantasy, Shounen, Super Power, Supernatural, Vampire"
30916,The Five Killers,Action
30919,Sora no Method: Aru Shoujo no Kyuujitsu★,"Slice of Life, Fantasy, Comedy"
30920,Utopa,Sci-Fi
30921,Kacchikenee!,Supernatural
30922,Kaze no Matasaburou (Movie),"Supernatural, Fantasy"
30923,Colorful Ninja Iromaki,Fantasy
30924,Mikagura Gakuen Kumikyoku,"Music, Psychological, School"
30925,Gatchaman Crowds Insight: Inbound,"Sci-Fi, Adventure"
30926,Akazukin Chanto Manabou! Koutsuu Rule,"Drama, Kids"
30927,"Hanakappa no Koutsuu Anzen: Cake wo Momomete Migi, Hidari, Migi","Drama, Fantasy, Kids"
30928,Tobidashi wa Abunaizo! Mushi Mushi Mura no Koutsuu Anzen,"Drama, Kids"
30929,Aladdin to Mahou no Lamp no Koutsuu Anzen,"Drama, Fantasy, Kids"
30930,Mameushi-kun no Koutsuu Anzen,"Drama, Kids"
30931,Usagi to Kame no Koutsuu Anzen,"Drama, Fantasy, Kids"
30932,Oz no Mahoutsukai no Koutsuu Anzen no Tabi,"Kids, Drama, Fantasy"
30933,Son Gokuu no Koutsuu Rule Shugyou Chuu,"Drama, Fantasy, Kids"
30935,Douwa Mondai to Jinken: Anata wa Dou Kangaemasuka,Drama
30938,Ijime Juuyon-sai no Message,Drama
30939,Shiranpuri,"Drama, School"
30940,Shounen Muku Hatojuu Monogatari,"Drama, Kids"
30941,Utsukushii Message,"Drama, Kids"
30942,Ojarumaru: Chitchai Mono no Ookina Chikara,"Kids, Historical"
30943,Ojiichan wa Boku no Hero,"Drama, Kids"
30944,Muku Hatojuu no Meiken Monogatari,"Adventure, Drama, Kids"
30947,Kurayami Santa,"Historical, Supernatural"
30948,Kowabon,Horror
30952,New Initial D Movie: Legend 3 - Mugen,"Cars, Seinen, Sports"
30953,Arslan Senki (TV) Specials,Comedy
30954,Jakusansei Million Arthur,"Comedy, Parody, Ecchi, Fantasy"
30955,Crazy Monkey,Ecchi
30957,Yukidaruma,"Fantasy, Historical"
30958,Daruma-chan,"Kids, Supernatural"
30959,Charamaru-kun to Dokumaru-kun,"Kids, Super Power"
30960,Shou-chan Sora wo Tobu,"Horror, Sci-Fi"
30961,Sylvanian Families Mini Gekijou: Omoigakenai Okyakusama,Slice of Life
30965,Ninpuu Kamui Gaiden: Tsukihigai no Maki,"Action, Adventure, Historical, Martial Arts, Samurai"
30967,Chuumon no Ooi Ryouriten (1993),"Horror, Supernatural, Fantasy"
30968,Kokoro no Catchball,"Kids, Sports"
30969,Yasashii Ookami,Kids
30970,Jidou Bungaku Library,"Demons, Drama, Fantasy, Historical, Kids, Magic, Romance, Samurai, Supernatural"
30971,Tanita Shokudou,Slice of Life
30973,Urashima Tarou (1952),Historical
30974,Wasurerumonka!,"Drama, Kids"
30975,Nanoha,"Drama, Historical, Kids"
30976,Kiminari Dousuru? Yuukai Itazura: Sarenai Tame ni,"Drama, Kids"
30977,Umi no Koumori,"Drama, Kids"
30978,Okaasan no Yasashii te,"Drama, Kids"
30979,Hachikadzuki-hime,"Drama, Fantasy, Historical, Kids"
30980,Ojiichan no Hanabi,"Drama, Kids"
30981,Hotaru no Mau Machi de,"Drama, Kids"
30982,Shutter Chance,"Drama, Kids"
30983,Shibuzome Ikki: Ashita ni Kakeru Niji,"Historical, Kids"
30984,Bero-dashi Chonma,"Historical, Kids"
30985,Yamakoshi Mura no Mari to Sanbiki no Koinu,"Drama, Kids"
30988,Futsuu no Joshikousei ga [Locodol] Yattemita. OVA,"Slice of Life, Comedy, Seinen"
30989,Bary-san no Imabari-ben Kouza,Comedy
30991,Himouto! Umaru-chan OVA,"Slice of Life, Comedy, School, Seinen"
30997,Ojiichan no Tomato,"Drama, Kids"
30998,Yuujou no Kickoff,"Drama, Kids, Sports"
30999,Ningen no Uta,"Drama, Kids"
31000,Kizuna: Ningen no Uta Part 2,"Drama, Kids"
31001,Mirai Kara no Message,"Drama, Kids"
31002,Nibiki no Neko to Genkina Kazoku,"Drama, Kids"
31003,Boku no Aozora,"Drama, Kids"
31004,Niji no Kakehashi,"Drama, Kids"
31005,Souta no Chikai: Sabetsu ni Makenai Chikara,"Drama, Historical, Kids"
31007,Kumori Nochi Hare,"Drama, Kids"
31008,Makeruna! Senta: Sayonara Ijime Mushi,"Drama, Kids"
31009,Mebuki,"Drama, Kids"
31014,Aru Zombie Shoujo no Sainan,"Action, Horror"
31015,Kakusensou,"Drama, Historical, Kids"
31016,Juuroku Jizou Monogatari: Sensou no Gisei ni Natta Kodomo-tachi,"Drama, Historical, Kids"
31017,Neko wa Ikite Iru,"Kids, Historical, Drama"
31018,DD Hokuto no Ken 2 Ichigo Aji+,"Comedy, Parody, School, Seinen"
31019,Norasco (TV),"Slice of Life, Comedy"
31020,Norasco: Cinema Point Card-hen,"Comedy, Slice of Life"
31033,Nintama Rantarou: Dokutake Onsen no Dan,Comedy
31034,Nintama Rantarou: Ninjutsu Gakuen to Nazo no Onna - Kore wa Jiken Da yo! no Dan,Comedy
31035,Inferno Cop Specials,"Action, Comedy"
31043,Boku dake ga Inai Machi,"Mystery, Psychological, Seinen, Supernatural"
31044,Kamisama Minarai: Himitsu no Cocotama,"Slice of Life, Kids, Magic, Fantasy"
31048,Burenai Ai de,Music
31049,Beyblade Burst,"Action, Sci-Fi, Adventure, Sports, Shounen"
31050,Cyborg 009 VS Devilman,"Action, Sci-Fi, Super Power, Demons, Supernatural, Shounen"
31051,Kuroko no Basket: Saikou no Present Desu,"Action, Sports, School, Shounen"
31052,Saru Getchu Movie: Ougon no Pipo Helmet - Ukki Battle,"Adventure, Comedy, Shounen"
31054,"Letchu, Getchu, Saru Getchu",Comedy
31055,Tobidasu PriPara: Mi~nna de Mezase! Idol☆Grand Prix,"Music, Slice of Life, School, Shoujo"
31056,Fate/kaleid liner Prisma☆Illya 2wei Herz! Specials,"Comedy, Magic, Ecchi"
31057,Onaka Hime,Fantasy
31064,Gunslinger Stratos: The Animation - Kikan/Kaze no Yukue,"Action, Sci-Fi"
31065,Gunslinger Stratos: The Animation - Bunki/Futatsu no Mirai,"Action, Sci-Fi"
31068,Hime Chen! Otogi Chikku Idol Lilpri (2011),"Magic, Shoujo"
31070,Etotama Specials,"Action, Comedy, Fantasy"
31071,"Kinyoru, Abe Reiji: Heikinteki na Salaryman no Ijou na Nichijou",Comedy
31072,Show By Rock!!: Legend of Shingan Crimsonz,"Comedy, Music"
31073,Show By Rock!!: Plasmagica na Gogo,Comedy
31080,Anne Happy♪,"Slice of Life, Comedy, School"
31091,Komori-san wa Kotowarenai!,"Slice of Life, Comedy, School"
31096,Hibike! Euphonium: Suisougaku-bu no Nichijou,"Comedy, Music, School"
31098,Ushio to Tora (TV) 2nd Season,"Action, Adventure, Comedy, Demons, Supernatural, Shounen"
31102,Taiko no Tatsujin: 15 Shuunenkinen Short Animation,Game
31105,Buddy Complex: Daremo Shiranai Ashita e,"Action, Mecha, Sci-Fi"
31107,Summer Train!,Slice of Life
31108,Green Dakara x Bakemono no Ko,Music
31109,Hatsukoi Monster,"Comedy, Romance, School, Shoujo"
31111,Nisshin Seifun Group CM,"Kids, Slice of Life"
31113,Puchitto Furikaerintia,"Action, Adventure, Mecha, Sci-Fi"
31115,Schick x Evangelion,"Comedy, Parody"
31116,Momotaros no Natsuyasumi,"Action, Comedy, Kids, Parody, Super Power"
31121,Monster Musume no Iru Nichijou: Hobo Mainichi ◯◯! Namappoi Douga,"Slice of Life, Comedy"
31128,Arslan Senki (TV): Dakkan no Yaiba,"Action, Adventure, Fantasy, Supernatural, Historical, Drama"
31129,Chichi to Ko,Drama
31133,Shounen Sunday CM Gekijou: InuYasha-hen,"Action, Fantasy, Demons"
31135,Idea ga Tsukamaranai.,Dementia
31137,Mahou Shoujo Lyrical Nanoha ViVid: Special Program,"Action, Magic"
31138,Overlord: Ple Ple Pleiades,"Action, Comedy, Magic, Fantasy"
31139,Ame-iro Cocoa: Rainy Color e Youkoso!,"Slice of Life, Comedy"
31143,Onsen Yousei Hakone-chan,"Comedy, Seinen, Slice of Life"
31144,Mottainai,Slice of Life
31145,Code Geass: Boukoku no Akito 3 - Kagayaku Mono Ten yori Otsu Picture Drama,"Comedy, Military"
31147,Concrete Revolutio: Choujin Gensou,"Action, Demons, Drama, Fantasy, Mystery, Sci-Fi, Super Power, Supernatural"
31149,Persona 3 the Movie 4: Winter of Rebirth,"Action, Supernatural, Fantasy"
31150,Xi Yang Yang Yu Hui Tai Lang,"Adventure, Comedy, Kids"
31156,"Kuusen Madoushi Kouhosei no Kyoukan: Lecty no, Ikimonogatari","Action, Drama, Magic, Fantasy, School"
31157,ClassicaLoid,"Music, Comedy"
31158,Hetalia: The World Twinkle Specials,"Comedy, Historical, Parody"
31163,Dimension W,"Action, Sci-Fi, Seinen"
31164,Aloha! Youkai Watch: Rakuen Hawaii de Geragerapou!!,"Slice of Life, Kids, Supernatural"
31165,Meiji x Kokosake & anohana Receipt Oubo Campaign,Drama
31166,Nyamen: Tenkai Daiichi Joshi Koukou Bunka Matsuri Tokubetsu Eizou,Music
31168,Pokemon XY: Odemashi Ko Majin Hoopa,"Action, Fantasy, Kids"
31170,Youkai Ninpouchou Jiraiya!,"Action, Comedy"
31173,Akagami no Shirayuki-hime 2nd Season,"Drama, Romance, Fantasy, Shoujo"
31174,Osomatsu-san,"Comedy, Parody"
31177,Yakyuubu Aruaru,Sports
31178,Uta no☆Prince-sama♪ Maji Love Legend Star,"Harem, Music, Comedy, Romance, Shoujo"
31181,Owarimonogatari,"Mystery, Comedy, Supernatural, Vampire"
31196,Cardfight!! Vanguard G: GIRS Crisis-hen,"Action, Game, Shounen"
31201,Doraemon Movie 36: Shin Nobita no Nippon Tanjou,"Adventure, Comedy, Kids, Fantasy, Shounen"
